rank_dificuldade,pergunta_norm,pergunta,resposta_oficial,n_modelos,n_correto,n_parcialmente_correto,n_incorreto,score_medio_0_5,score_min,score_max,desvio_medio_entre_julgadores,modelos_incorretos,modelos_parciais,modelos_corretos,taxa_erro,taxa_nao_correto
1,"a pessoa jurídica que explora atividade rural e que tenha utilizado o benefício fiscal da depreciação incentivada, ao mudar para o regime de tributação do lucro presumido ou arbitrado deve adicionar à base de cálculo do imposto de renda o saldo dessa depreciação?","A pessoa jurídica que explora atividade rural e que tenha utilizado o benefício  fiscal da depreciação incentivada, ao mudar para o regime de tributação do lucro  presumido ou arbitrado deve adicionar à base de cálculo do imposto de renda o  saldo dessa depreciação?","Não. A reversão da depreciação incentivada que deve ser adicionado ao lucro líquido para determinação do lucro real e controlada na Parte B do e-Lalur e na Parte B do e- Lacs, não é a decorrente de tributação diferida, uma vez que a adição se impõe em virtude de anular os efeitos decorrentes da depreciação normal consignada na escrituração comercial da pessoa jurídica rural. No regime de tributação do lucro presumido ou arbitrado, prescinde-se da escrita regular, e, em consequência, não há o aludido efeito de depreciação normal a ser compensado pela adição.",11,0,0,11,0.303030303030303,0.0,2.0,0.05248638810814779,"claude-opus-4-6, deepseek-ai_deepseek-v4-flash, gemini-3-pro-preview, google_gemma-4-31b-it, gpt-5.1, meta_llama-3.3-70b-instruct, mistralai_mixtral-8x22b-instruct-v0.1, openai_gpt-oss-120b, qwen2-72B-Instruct, qwen_qwen3.5-122b-a10b, z-ai_glm-5.1",,,1.0,1.0
2,como deve proceder o contribuinte que deixou de contabilizar ou contabilizou a menor o valor da provisão para o imposto sobre a renda?,Como deve proceder o contribuinte que deixou de contabilizar ou contabilizou  a menor o valor da provisão para o imposto sobre a renda?,"Deve, no curso do período de apuração seguinte, mediante lançamento de ajuste em contas próprias, com efeitos retroativos ao início do período de apuração, regularizar sua situação contábil pelo registro do valor da provisão (ou da diferença a menor apurada), a débito de conta do patrimônio líquido (prejuízos acumulados).",11,0,0,11,0.9696969696969696,0.3333333333333333,2.0,0.5632865838824211,"claude-opus-4-6, deepseek-ai_deepseek-v4-flash, gemini-3-pro-preview, google_gemma-4-31b-it, gpt-5.1, meta_llama-3.3-70b-instruct, mistralai_mixtral-8x22b-instruct-v0.1, openai_gpt-oss-120b, qwen2-72B-Instruct, qwen_qwen3.5-122b-a10b, z-ai_glm-5.1",,,1.0,1.0
3,como determinar o capital da empresa individual no caso de pessoa física equiparada por prática de operações imobiliárias?,Como determinar o capital da empresa individual no caso de pessoa física  equiparada por prática de operações imobiliárias?,"O capital da empresa individual, no início de cada período de apuração (trimestral ou anual), será representado pela soma dos valores dos imóveis constantes do seu ativo com os valores a receber relativos ao custo dos imóveis já vendidos em períodos de apuração anteriores.",11,0,0,11,1.0909090909090908,0.3333333333333333,1.6666666666666667,0.793061604941689,"claude-opus-4-6, deepseek-ai_deepseek-v4-flash, gemini-3-pro-preview, google_gemma-4-31b-it, gpt-5.1, meta_llama-3.3-70b-instruct, mistralai_mixtral-8x22b-instruct-v0.1, openai_gpt-oss-120b, qwen2-72B-Instruct, qwen_qwen3.5-122b-a10b, z-ai_glm-5.1",,,1.0,1.0
4,em quais hipóteses existe a possibilidade de apropriação de créditos presumidos da contribuição para o pis/pasep e da cofins relativos a selo de controle e equipamentos de controle de produção?,Em quais hipóteses existe a possibilidade de apropriação de créditos presumidos  da Contribuição para o PIS/Pasep e da Cofins relativos a selo de controle e  equipamentos de controle de produção?,"As pessoas jurídicas obrigadas pela RFB à utilização do selo de controle de que trata o art. 46 da Lei nº 4.502, de 30 de novembro de 1964; e dos equipamentos contadores de produção de que tratam os arts. 27 a 30 da Lei nº 11.488, de 2007, e o art. 58-T da Lei nº 10.833, de 2003, poderão deduzir da Contribuição para o PIS/PASEP ou da COFINS devidas em cada período de apuração, crédito presumido correspondente à taxa de que trata o art. 13 da Lei nº 12.995, de 2014, efetivamente paga no mesmo período",11,0,0,11,1.0909090909090908,0.0,2.6666666666666665,0.6112434231235072,"claude-opus-4-6, deepseek-ai_deepseek-v4-flash, gemini-3-pro-preview, google_gemma-4-31b-it, gpt-5.1, meta_llama-3.3-70b-instruct, mistralai_mixtral-8x22b-instruct-v0.1, openai_gpt-oss-120b, qwen2-72B-Instruct, qwen_qwen3.5-122b-a10b, z-ai_glm-5.1",,,1.0,1.0
5,"a pessoa jurídica optante pelo lucro presumido que mantiver escrituração regular e apurar lucro contábil poderá utilizá-lo como reserva livre para aumento de capital, sem ônus tributário (voltando ou não à tributação pelo lucro real)?","A pessoa jurídica optante pelo lucro presumido que mantiver escrituração  regular e apurar lucro contábil poderá utilizá-lo como reserva livre para aumento  de capital, sem ônus tributário (voltando ou não à tributação pelo lucro real)?","Na hipótese de apuração de lucro contábil, a pessoa jurídica poderá utilizar o montante desse lucro como reserva livre para aumento de capital. Entretanto, não poderá utilizar a esse título todo o montante do lucro contábil, devendo dele diminuir o valor do imposto de renda apurado com base no lucro presumido, inclusive adicional, o valor das contribuições (CSLL, Cofins e PIS/Pasep), bem assim os valores que forem distribuídos a título de lucros ao seu titular, sócio ou acionista.",11,0,1,10,1.787878787878788,0.3333333333333333,3.0,0.824844804205076,"claude-opus-4-6, deepseek-ai_deepseek-v4-flash, gemini-3-pro-preview, google_gemma-4-31b-it, meta_llama-3.3-70b-instruct, mistralai_mixtral-8x22b-instruct-v0.1, openai_gpt-oss-120b, qwen2-72B-Instruct, qwen_qwen3.5-122b-a10b, z-ai_glm-5.1",gpt-5.1,,0.9090909090909091,1.0
6,"em que momento deve ser tributado o lucro gerado por uma empresa estrangeira, classificada pela legislação brasileira como coligada ou porfólio de investimento sem influência nem relevância, cuja participação societária seja detida por uma por controlada direta ou indireta da controladora brasileira?","Em que momento deve ser tributado o lucro gerado por uma empresa  estrangeira, classificada pela legislação brasileira como coligada ou porfólio de  investimento sem influência nem relevância, cuja participação societária seja  detida por uma por controlada direta ou indireta da controladora brasileira?","Os lucros gerados por empresas tidas como coligadas das controladas diretas ou indiretas ou como participações em empresas de portfólio, detidas por controlada direta ou indireta domiciliadas no exterior, serão tributados pela controladora brasileira quando forem reconhecidos no balanço da controlada direta ou indireta, segundo a legislação comercial de sua jurisdição.",11,0,1,10,1.8787878787878787,0.6666666666666666,3.333333333333333,0.8455479930498367,"deepseek-ai_deepseek-v4-flash, gemini-3-pro-preview, google_gemma-4-31b-it, gpt-5.1, meta_llama-3.3-70b-instruct, mistralai_mixtral-8x22b-instruct-v0.1, openai_gpt-oss-120b, qwen2-72B-Instruct, qwen_qwen3.5-122b-a10b, z-ai_glm-5.1",claude-opus-4-6,,0.9090909090909091,1.0
7,"as disposições contidas na instrução normativa srf nº 11, de 10 de fevereiro de 1999, eram aplicadas somente às operações de incorporação, fusão e cisão, ocorridas até 31 de dezembro de 2017, cuja participação societária tenha sido adquirida até 31 de dezembro de 2014, desde que o processo de aquisição tenha sido iniciado até 31 de dezembro de 2014. neste sentido, o que pode ser entendido como início do processo de aquisição?","As disposições contidas na Instrução Normativa SRF nº 11, de 10 de fevereiro  de 1999, eram aplicadas somente às operações de incorporação, fusão e cisão,  ocorridas até 31 de dezembro de 2017, cuja participação societária tenha sido  adquirida até 31 de dezembro de 2014, desde que o processo de aquisição  tenha sido iniciado até 31 de dezembro de 2014. Neste sentido, o que pode ser  entendido como início do processo de aquisição?",O pedido de aprovação da aquisição junto ao órgão regulador ou fiscalizador deve ter sido protocolizado até 31 de dezembro de 2014.,11,0,2,9,1.2424242424242424,0.0,3.6666666666666665,0.8071252902488937,"claude-opus-4-6, gemini-3-pro-preview, google_gemma-4-31b-it, gpt-5.1, meta_llama-3.3-70b-instruct, mistralai_mixtral-8x22b-instruct-v0.1, openai_gpt-oss-120b, qwen2-72B-Instruct, qwen_qwen3.5-122b-a10b","deepseek-ai_deepseek-v4-flash, z-ai_glm-5.1",,0.8181818181818182,1.0
8,o que poderá acontecer à pessoa jurídica que optar indevidamente ou deixar de cumprir alguma das condições estabelecidas para opção pelo lucro presumido?,O que poderá acontecer à pessoa jurídica que optar indevidamente ou deixar de  cumprir alguma das condições estabelecidas para opção pelo lucro presumido?,"Inicialmente será verificada a possibilidade de apuração da base de cálculo do imposto de renda pelo lucro real, caso a empresa mantenha escrituração regular com base nas leis comerciais e fiscais. Na impossibilidade de adoção de tal procedimento, deverá ser arbitrado o lucro da pessoa jurídica no respectivo período de apuração.",11,1,2,8,2.8787878787878785,2.333333333333333,4.0,0.524863881081478,"claude-opus-4-6, deepseek-ai_deepseek-v4-flash, google_gemma-4-31b-it, meta_llama-3.3-70b-instruct, openai_gpt-oss-120b, qwen2-72B-Instruct, qwen_qwen3.5-122b-a10b, z-ai_glm-5.1","gemini-3-pro-preview, gpt-5.1",mistralai_mixtral-8x22b-instruct-v0.1,0.7272727272727273,0.9090909090909091
9,"o que é “despesa financeira” considerada nas contraprestações pagas ou creditadas, a que se refere o inciso i do art. 175 da in rfb nº 1.700, de 2017?","O que é “despesa financeira” considerada nas contraprestações pagas ou  creditadas, a que se refere o inciso I do art. 175 da IN RFB nº 1.700, de 2017?","São os encargos financeiros, incluindo-se os juros decorrentes do ajuste a valor presente.",11,0,4,7,2.6363636363636362,2.0,3.333333333333333,0.47237749297333026,"claude-opus-4-6, deepseek-ai_deepseek-v4-flash, gemini-3-pro-preview, google_gemma-4-31b-it, meta_llama-3.3-70b-instruct, qwen_qwen3.5-122b-a10b, z-ai_glm-5.1","gpt-5.1, mistralai_mixtral-8x22b-instruct-v0.1, openai_gpt-oss-120b, qwen2-72B-Instruct",,0.6363636363636364,1.0
10,quais os efeitos tributários no caso de a ecf retificadora apresentar valores a título de irpj e de csll diferentes daqueles inicialmente apresentados na ecf retificada?,Quais os efeitos tributários no caso de a ECF retificadora apresentar valores a  título de IRPJ e de CSLL diferentes daqueles inicialmente apresentados na ECF  retificada?,"Quando a retificação da ECF apresentar imposto maior que o da ECF retificada, a diferença apurada será devida com os acréscimos correspondentes. Quando a retificação da ECF apresentar imposto menor que o da ECF retificada, a diferença apurada, desde que paga, poderá ser compensada ou restituída. Sobre o montante a ser compensado ou restituído incidirão juros equivalentes à taxa referencial do Sistema Especial de Liquidação e Custódia (Selic), acumulados até o mês anterior ao da restituição ou compensação, adicionado de 1% (um por cento) no mês da restituição ou compensação.",11,2,2,7,2.090909090909091,0.0,4.333333333333333,0.5632865838824211,"deepseek-ai_deepseek-v4-flash, gemini-3-pro-preview, google_gemma-4-31b-it, meta_llama-3.3-70b-instruct, qwen2-72B-Instruct, qwen_qwen3.5-122b-a10b, z-ai_glm-5.1","mistralai_mixtral-8x22b-instruct-v0.1, openai_gpt-oss-120b","claude-opus-4-6, gpt-5.1",0.6363636363636364,0.8181818181818182
11,como será manifestada pelo contribuinte a tributação com base no lucro arbitrado?,Como será manifestada pelo contribuinte a tributação com base no lucro  arbitrado?,"A tributação com base no lucro arbitrado será manifestada mediante o pagamento da primeira quota ou da quota única do imposto devido, correspondente ao período de apuração trimestral em que o contribuinte, conhecendo sua receita bruta, verificou que incidiu em uma das hipóteses que ensejam o arbitramento de seu lucro.",11,3,2,6,2.7878787878787876,1.0,4.333333333333333,0.5492228985752164,"deepseek-ai_deepseek-v4-flash, google_gemma-4-31b-it, gpt-5.1, openai_gpt-oss-120b, qwen2-72B-Instruct, qwen_qwen3.5-122b-a10b","meta_llama-3.3-70b-instruct, mistralai_mixtral-8x22b-instruct-v0.1","claude-opus-4-6, gemini-3-pro-preview, z-ai_glm-5.1",0.5454545454545454,0.7272727272727273
12,"dos resultados das controladas diretas ou indiretas no exterior não devem constar os resultados auferidos por outra pessoa jurídica sobre a qual a controladora brasileira mantenha o controle direto ou indireto. esta regra se aplica também para a apuração do estoque de prejuízos anteriores a 01/01/2015, passiveis de compensação com lucros futuros para efeitos de tributação no brasil?","Dos resultados das controladas diretas ou indiretas no exterior não devem  constar os resultados auferidos por outra pessoa jurídica sobre a qual a  controladora brasileira mantenha o controle direto ou indireto. Esta regra se  aplica também para a apuração do estoque de prejuízos anteriores a  01/01/2015, passiveis de compensação com lucros futuros para efeitos de  tributação no Brasil?","Em obediência à uniformidade de critério, na falta de ressalva em Lei, dos prejuízos contábeis anteriores a 2015 não devem constar resultados (lucros ou prejuízos) originados da participação em outra pessoa jurídica sobre a qual a controladora brasileira mantenha controle direto ou indireto.",11,5,0,6,2.4242424242424243,0.0,5.0,0.3008546433416821,"gemini-3-pro-preview, google_gemma-4-31b-it, meta_llama-3.3-70b-instruct, openai_gpt-oss-120b, qwen_qwen3.5-122b-a10b, z-ai_glm-5.1",,"claude-opus-4-6, deepseek-ai_deepseek-v4-flash, gpt-5.1, mistralai_mixtral-8x22b-instruct-v0.1, qwen2-72B-Instruct",0.5454545454545454,0.5454545454545454
13,"pessoa jurídica que apresentou declaração com base no lucro presumido poderá, após a entrega, pedir retificação para efeito de declarar pelo lucro real?","Pessoa Jurídica que apresentou declaração com base no lucro presumido  poderá, após a entrega, pedir retificação para efeito de declarar pelo lucro real?","Após a entrega da declaração de informações com base no lucro presumido, não há mais como o contribuinte alterar a sua opção. Entretanto, será admitida a retificação da declaração quando o contribuinte comprovar ter exercido irregularmente a opção pelo lucro presumido, na hipótese em que a legislação fiscal expressamente torne obrigatória a sua tributação com base no lucro real; ou, ainda, quando for constatado tal fato por meio de procedimento de ofício, o qual poderá adotar a tributação com base no lucro real quando exigido por lei, ou o lucro arbitrado, dependendo do caso.",11,1,5,5,2.727272727272727,1.3333333333333333,4.0,0.7649342343272796,"claude-opus-4-6, deepseek-ai_deepseek-v4-flash, gemini-3-pro-preview, google_gemma-4-31b-it, qwen2-72B-Instruct","gpt-5.1, meta_llama-3.3-70b-instruct, openai_gpt-oss-120b, qwen_qwen3.5-122b-a10b, z-ai_glm-5.1",mistralai_mixtral-8x22b-instruct-v0.1,0.45454545454545453,0.9090909090909091
14,o registro da csll como despesa afetará o cálculo do lucro da exploração?,O registro da CSLL como despesa afetará o cálculo do lucro da exploração?,"A CSLL será adicionada ao lucro líquido do período de apuração, antes da provisão para o imposto de renda, para efeito de determinação do lucro da exploração, que servirá de base de cálculo de incentivos fiscais.",11,5,1,5,3.5757575757575752,2.333333333333333,5.0,0.5773502691896258,"claude-opus-4-6, deepseek-ai_deepseek-v4-flash, mistralai_mixtral-8x22b-instruct-v0.1, qwen2-72B-Instruct, z-ai_glm-5.1",qwen_qwen3.5-122b-a10b,"gemini-3-pro-preview, google_gemma-4-31b-it, gpt-5.1, meta_llama-3.3-70b-instruct, openai_gpt-oss-120b",0.45454545454545453,0.5454545454545454
15,a isenção do irpj depende de prévio reconhecimento pela secretaria especial da receita federal do brasil?,A isenção do IRPJ depende de prévio reconhecimento pela Secretaria Especial da  Receita Federal do Brasil?,Não. O benefício da isenção do IRPJ independe do prévio reconhecimento pela Secretaria Especial da Receita Federal do Brasil.,11,4,3,4,3.5454545454545454,2.0,5.0,1.1082240086585893,"gemini-3-pro-preview, google_gemma-4-31b-it, meta_llama-3.3-70b-instruct, qwen2-72B-Instruct","claude-opus-4-6, gpt-5.1, openai_gpt-oss-120b","deepseek-ai_deepseek-v4-flash, mistralai_mixtral-8x22b-instruct-v0.1, qwen_qwen3.5-122b-a10b, z-ai_glm-5.1",0.36363636363636365,0.6363636363636364
16,pessoa jurídica que retornar ao lucro real poderá fazer jus à depreciação acelerada incentivada?,Pessoa jurídica que retornar ao lucro real poderá fazer jus à depreciação  acelerada incentivada?,"Sim. Retornando à tributação com base no lucro real a pessoa jurídica deverá adicionar o encargo de depreciação normal registrado na escrituração comercial, relativo a bens já totalmente depreciados, ao resultado da atividade rural, efetuando a baixa do respectivo valor no saldo da depreciação incentivada controlado na Parte B do e-Lalur e do e-Lacs.",11,5,2,4,2.6969696969696972,0.0,4.666666666666667,0.7129003394337476,"meta_llama-3.3-70b-instruct, mistralai_mixtral-8x22b-instruct-v0.1, openai_gpt-oss-120b, qwen2-72B-Instruct","claude-opus-4-6, deepseek-ai_deepseek-v4-flash","gemini-3-pro-preview, google_gemma-4-31b-it, gpt-5.1, qwen_qwen3.5-122b-a10b, z-ai_glm-5.1",0.36363636363636365,0.5454545454545454
17,a absorção na escrituração comercial de prejuízos contábeis impede a compensação dos prejuízos fiscais?,A absorção na escrituração comercial de prejuízos contábeis impede a  compensação dos prejuízos fiscais?,"A absorção na escrituração comercial de prejuízos contábeis apurados mediante débito à conta de lucros acumulados, de reservas de lucros ou de capital, ao capital social, ou à conta de sócios, matriz ou titular de empresa individual, não impede a compensação dos prejuízos fiscais.",11,3,5,3,3.1818181818181817,0.6666666666666666,4.666666666666667,0.7546389021407459,"gemini-3-pro-preview, google_gemma-4-31b-it, meta_llama-3.3-70b-instruct","deepseek-ai_deepseek-v4-flash, mistralai_mixtral-8x22b-instruct-v0.1, openai_gpt-oss-120b, qwen2-72B-Instruct, z-ai_glm-5.1","claude-opus-4-6, gpt-5.1, qwen_qwen3.5-122b-a10b",0.2727272727272727,0.7272727272727273
18,"qual o destino a ser dado aos imóveis integrantes do ativo (patrimônio) da empresa individual quando, completado o prazo de 36 (trinta e seis) meses consecutivos sem promover incorporações ou loteamentos, ocorrer o término da equiparação à pessoa jurídica?","Qual o destino a ser dado aos imóveis integrantes do ativo (patrimônio) da  empresa individual quando, completado o prazo de 36 (trinta e seis) meses  consecutivos sem promover incorporações ou loteamentos, ocorrer o término  da equiparação à pessoa jurídica?","Permanecerão no ativo da empresa individual, para efeito de tributação como lucro da pessoa jurídica: a) as unidades imobiliárias e os lotes de terrenos integrantes de incorporações ou loteamentos, até sua alienação e, após esta, o saldo a receber, até o recebimento total do preço; b) o saldo a receber do preço dos imóveis então alienados, até seu recebimento total.",11,4,4,3,3.333333333333333,1.6666666666666667,5.0,0.9472274548514809,"mistralai_mixtral-8x22b-instruct-v0.1, openai_gpt-oss-120b, qwen_qwen3.5-122b-a10b","deepseek-ai_deepseek-v4-flash, gemini-3-pro-preview, gpt-5.1, z-ai_glm-5.1","claude-opus-4-6, google_gemma-4-31b-it, meta_llama-3.3-70b-instruct, qwen2-72B-Instruct",0.2727272727272727,0.6363636363636364
19,"qual o tratamento aplicável, em relação ao ganho de capital, aos contratos não tipificados como arrendamento mercantil e que contenham elementos contabilizados como arrendamento mercantil por força de normas contábeis e da legislação comercial?","Qual o tratamento aplicável, em relação ao ganho de capital, aos contratos não  tipificados como arrendamento mercantil e que contenham elementos  contabilizados como arrendamento mercantil por força de normas contábeis e  da legislação comercial?","Em relação aos contratos não tipificados como arrendamento mercantil que contenham elementos contabilizados como arrendamento mercantil por força de normas contábeis e da legislação comercial, a determinação do ganho ou perda de capital de bens ou direitos que tenham sido objeto de arrendamento mercantil terá por base o valor contábil do bem, assim entendido o que estiver registrado na escrituração do contribuinte, diminuído, se for o caso, da depreciação, amortização ou exaustão acumulada e das perdas estimadas no valor de ativos. O disposto acima não se aplica quando o valor contábil do bem já tiver sido computado na determinação do lucro real e do resultado ajustado pela arrendatária, a título de contraprestação de arrendamento mercantil. Neste caso, o resultado tributável da alienação corresponderá ao respectivo valor da alienação.",11,4,4,3,3.666666666666666,2.6666666666666665,5.0,0.20994555243259122,"deepseek-ai_deepseek-v4-flash, meta_llama-3.3-70b-instruct, mistralai_mixtral-8x22b-instruct-v0.1","gemini-3-pro-preview, gpt-5.1, openai_gpt-oss-120b, z-ai_glm-5.1","claude-opus-4-6, google_gemma-4-31b-it, qwen2-72B-Instruct, qwen_qwen3.5-122b-a10b",0.2727272727272727,0.6363636363636364
20,"em relação às operações de arrendamento mercantil, é necessária evidenciação em subconta?","Em relação às operações de arrendamento mercantil, é necessária  evidenciação em subconta?",No caso de bem objeto de arrendamento mercantil financeiro não é necessário que a arrendatária evidencie em subconta vinculada ao bem arrendado os juros decorrentes do ajuste a valor presente relativo ao contrato de arrendamento mercantil.,11,1,8,2,3.1515151515151514,2.6666666666666665,4.333333333333333,0.9608161014526662,"claude-opus-4-6, meta_llama-3.3-70b-instruct","deepseek-ai_deepseek-v4-flash, gemini-3-pro-preview, google_gemma-4-31b-it, mistralai_mixtral-8x22b-instruct-v0.1, openai_gpt-oss-120b, qwen2-72B-Instruct, qwen_qwen3.5-122b-a10b, z-ai_glm-5.1",gpt-5.1,0.18181818181818182,0.9090909090909091
21,como a pessoa jurídica que apura o imposto sobre a renda com base na estimativa de lucro mensal pode compensar o imposto pago indevidamente ou a maior em relação ao apurado com base na estimativa de lucro no respectivo mês?,Como a pessoa jurídica que apura o Imposto sobre a Renda com base na  estimativa de lucro mensal pode compensar o imposto pago indevidamente ou  a maior em relação ao apurado com base na estimativa de lucro no respectivo  mês?,"Os valores do IRPJ e da CSLL pagos e que excederem os apurados com base na estimativa de lucro no respectivo mês somente podem ser utilizados no final do período de apuração em que houve o pagamento indevido ou maior que o devido para: a) dedução do IRPJ ou da CSLL; b) ou compor o saldo negativo de IRPJ ou de CSLL. No caso de pagamento calculado com base na estimativa de lucro mensal, o final do período de apuração é, em regra, 31 de dezembro. Excepcionalmente, no caso de pessoas jurídicas submetidas aos seguintes eventos, o final do período de apuração será a data do evento: a) incorporação, fusão ou cisão; b) extinção da pessoa jurídica, pelo encerramento da liquidação.",11,2,7,2,3.3636363636363638,1.6666666666666667,4.333333333333333,0.7207457482068645,"google_gemma-4-31b-it, openai_gpt-oss-120b","claude-opus-4-6, deepseek-ai_deepseek-v4-flash, meta_llama-3.3-70b-instruct, mistralai_mixtral-8x22b-instruct-v0.1, qwen2-72B-Instruct, qwen_qwen3.5-122b-a10b, z-ai_glm-5.1","gemini-3-pro-preview, gpt-5.1",0.18181818181818182,0.8181818181818182
22,"como a pessoa jurídica que apura o irpj com base na estimativa de lucro mensal pode compensar o imposto sobre a renda retido na fonte (irrf), retido indevidamente ou a maior que o devido?","Como a pessoa jurídica que apura o IRPJ com base na estimativa de lucro mensal  pode compensar o Imposto sobre a Renda Retido na Fonte (IRRF), retido  indevidamente ou a maior que o devido?","Os valores do IRRF e da CSLL retidos na fonte e que excederem os apurados com base na estimativa de lucro no respectivo mês somente podem ser utilizados no final do período de apuração em que houve a retenção para: a) dedução do IRPJ ou da CSLL; b) ou compor o saldo negativo de IRPJ ou de CSLL. No caso de pagamento calculado com base na estimativa de lucro mensal, o final do período de apuração é, em regra, 31 de dezembro. Excepcionalmente, no caso de pessoas jurídicas submetidas aos seguintes eventos, o final do período de apuração será a data do evento: a) incorporação, fusão ou cisão; b) extinção da pessoa jurídica, pelo encerramento da liquidação.",11,5,4,2,3.606060606060606,2.333333333333333,4.333333333333333,0.6157729719905689,"meta_llama-3.3-70b-instruct, openai_gpt-oss-120b","gemini-3-pro-preview, google_gemma-4-31b-it, qwen2-72B-Instruct, qwen_qwen3.5-122b-a10b","claude-opus-4-6, deepseek-ai_deepseek-v4-flash, gpt-5.1, mistralai_mixtral-8x22b-instruct-v0.1, z-ai_glm-5.1",0.18181818181818182,0.5454545454545454
