rank_dificuldade,pergunta_norm,pergunta,resposta_oficial,n_modelos,n_correto,n_parcialmente_correto,n_incorreto,score_medio_0_5,score_min,score_max,desvio_medio_entre_julgadores,modelos_incorretos,modelos_parciais,modelos_corretos,taxa_erro,taxa_nao_correto
70,a base de cálculo negativa da csll poderá ser compensada com resultados apurados em períodos subsequentes?,A base de cálculo negativa da CSLL poderá ser compensada com resultados  apurados em períodos subsequentes?,"Sim. A base de cálculo da CSLL, quando negativa, poderá ser compensada até o limite de 30% dos resultados apurados em períodos subsequentes, ajustados pelas adições e exclusões previstas na legislação.",11,11,0,0,4.606060606060606,4.0,5.0,0.5108001957742734,,,"claude-opus-4-6, deepseek-ai_deepseek-v4-flash, gemini-3-pro-preview, google_gemma-4-31b-it, gpt-5.1, meta_llama-3.3-70b-instruct, mistralai_mixtral-8x22b-instruct-v0.1, openai_gpt-oss-120b, qwen2-72B-Instruct, qwen_qwen3.5-122b-a10b, z-ai_glm-5.1",0.0,0.0
71,as sociedades por ações poderão ter quantos conselheiros fiscais?,As sociedades por ações poderão ter quantos conselheiros fiscais?,"O conselho fiscal será composto de, no mínimo, 3 (três), e no máximo, 5 (cinco) membros, e suplentes em igual número, acionistas ou não, eleitos pela assembleia- geral.",11,11,0,0,4.696969696969696,4.0,5.0,0.262431940540739,,,"claude-opus-4-6, deepseek-ai_deepseek-v4-flash, gemini-3-pro-preview, google_gemma-4-31b-it, gpt-5.1, meta_llama-3.3-70b-instruct, mistralai_mixtral-8x22b-instruct-v0.1, openai_gpt-oss-120b, qwen2-72B-Instruct, qwen_qwen3.5-122b-a10b, z-ai_glm-5.1",0.0,0.0
72,o controle por subcontas na adoção inicial se aplica aos ativos e passivos relativos aos contratos de arrendamento mercantil nos quais haja transferência substancial dos riscos e benefícios inerentes à propriedade do bem em curso na data da adoção inicial?,O controle por subcontas na adoção inicial se aplica aos ativos e passivos  relativos aos contratos de arrendamento mercantil nos quais haja  transferência substancial dos riscos e benefícios inerentes à propriedade do  bem em curso na data da adoção inicial?,"Não. Para os ativos e passivos relativos aos contratos de arrendamento mercantil em curso na data da adoção inicial, nos quais haja transferência substancial dos riscos e benefícios inerentes à propriedade do bem arrendado, não se aplica o controle por subcontas de que tratam os arts. 294 a 300 da Instrução Normativa RFB n° 1.700, de 2017. O disposto acima aplica-se, inclusive, aos contratos não tipificados como arrendamento mercantil que contenham elementos contabilizados como arrendamento mercantil por força de normas contábeis e da legislação comercial. A partir da data da adoção inicial, deverá ser observado o tratamento tributário previsto nos arts. 172 a 177 da Instrução Normativa RFB n° 1.700, de 2017.",11,11,0,0,4.696969696969696,4.0,5.0,0.262431940540739,,,"claude-opus-4-6, deepseek-ai_deepseek-v4-flash, gemini-3-pro-preview, google_gemma-4-31b-it, gpt-5.1, meta_llama-3.3-70b-instruct, mistralai_mixtral-8x22b-instruct-v0.1, openai_gpt-oss-120b, qwen2-72B-Instruct, qwen_qwen3.5-122b-a10b, z-ai_glm-5.1",0.0,0.0
73,"quando devem ser baixados os bens obsoletos, constantes do ativo imobilizado da pessoa jurídica?","Quando devem ser baixados os bens obsoletos, constantes do Ativo Imobilizado  da pessoa jurídica?","Quaisquer bens constantes do ativo imobilizado da pessoa jurídica, quer estejam totalmente depreciados ou não, somente podem ser baixados da contabilidade e do controle patrimonial concomitantemente à efetiva baixa física do bem.",11,11,0,0,4.696969696969696,4.0,5.0,0.3533410314498299,,,"claude-opus-4-6, deepseek-ai_deepseek-v4-flash, gemini-3-pro-preview, google_gemma-4-31b-it, gpt-5.1, meta_llama-3.3-70b-instruct, mistralai_mixtral-8x22b-instruct-v0.1, openai_gpt-oss-120b, qwen2-72B-Instruct, qwen_qwen3.5-122b-a10b, z-ai_glm-5.1",0.0,0.0
74,a variação cambial acrescida aos juros calculados com base na taxa libor são considerados dedutíveis na apuração do lucro real?,A variação cambial acrescida aos juros calculados com base na taxa LIBOR são  considerados dedutíveis na apuração do lucro real?,"Sim, uma vez que a referida variação cambial é um componente dos juros para o pagamento do imposto de renda diferido relativo aos lucros auferidos no exterior.",11,11,0,0,4.7272727272727275,4.333333333333333,5.0,0.3674047167570346,,,"claude-opus-4-6, deepseek-ai_deepseek-v4-flash, gemini-3-pro-preview, google_gemma-4-31b-it, gpt-5.1, meta_llama-3.3-70b-instruct, mistralai_mixtral-8x22b-instruct-v0.1, openai_gpt-oss-120b, qwen2-72B-Instruct, qwen_qwen3.5-122b-a10b, z-ai_glm-5.1",0.0,0.0
75,"como deverá proceder a pessoa jurídica que explora atividade rural com tributação pelo lucro real e, posteriormente, venha a optar pela tributação com base no lucro presumido ou arbitrado, e vier a alienar o bem depreciado com o incentivo fiscal?","Como deverá proceder a pessoa jurídica que explora atividade rural com  tributação pelo lucro real e, posteriormente, venha a optar pela tributação com  base no lucro presumido ou arbitrado, e vier a alienar o bem depreciado com o  incentivo fiscal?","A pessoa jurídica rural que tiver usufruído o benefício fiscal da depreciação acelerada incentivada, vindo, posteriormente, a ser tributada pelo lucro presumido ou arbitrado, caso aliene o bem depreciado com o incentivo durante a permanência nesses regimes, deverá adicionar à base de cálculo para determinação do lucro presumido ou arbitrado o saldo remanescente da depreciação não realizada.",11,11,0,0,4.7272727272727275,4.0,5.0,0.3674047167570346,,,"claude-opus-4-6, deepseek-ai_deepseek-v4-flash, gemini-3-pro-preview, google_gemma-4-31b-it, gpt-5.1, meta_llama-3.3-70b-instruct, mistralai_mixtral-8x22b-instruct-v0.1, openai_gpt-oss-120b, qwen2-72B-Instruct, qwen_qwen3.5-122b-a10b, z-ai_glm-5.1",0.0,0.0
76,quais as exclusões admitidas para efeito de apuração da base de cálculo da contribuição para o pis/pasep e da cofins devidas pelas sociedades cooperativas de rádio táxi?,Quais as exclusões admitidas para efeito de apuração da base de cálculo da  Contribuição para o PIS/Pasep e da Cofins devidas pelas sociedades cooperativas  de rádio táxi?,"Além das exclusões admitidas para as sociedades cooperativas em geral, as sociedades cooperativas de rádio táxi podem ainda excluir da base de cálculo: 1) os valores repassados aos associados pessoas físicas decorrentes de serviços por eles prestados em nome da cooperativa; 2) as receitas de vendas de bens, mercadorias e serviços a associados, quando adquiridos de pessoas físicas não associadas; e 3) as receitas financeiras decorrentes de repasses de empréstimos a associados, contraídos de instituições financeiras, até o limite dos encargos a estas devidos. ",11,11,0,0,4.7272727272727275,4.333333333333333,5.0,0.41989110486518244,,,"claude-opus-4-6, deepseek-ai_deepseek-v4-flash, gemini-3-pro-preview, google_gemma-4-31b-it, gpt-5.1, meta_llama-3.3-70b-instruct, mistralai_mixtral-8x22b-instruct-v0.1, openai_gpt-oss-120b, qwen2-72B-Instruct, qwen_qwen3.5-122b-a10b, z-ai_glm-5.1",0.0,0.0
77,qual o tratamento tributário da reversão contábil da perda estimada no valor do ativo?,Qual o tratamento tributário da reversão contábil da perda estimada no valor  do ativo?,As reversões das perdas por desvalorização de bens que foram objeto de redução ao valor recuperável de ativos não são computadas na apuração do lucro real e do resultado ajustado.,11,11,0,0,4.7272727272727275,4.333333333333333,5.0,0.31491832864888686,,,"claude-opus-4-6, deepseek-ai_deepseek-v4-flash, gemini-3-pro-preview, google_gemma-4-31b-it, gpt-5.1, meta_llama-3.3-70b-instruct, mistralai_mixtral-8x22b-instruct-v0.1, openai_gpt-oss-120b, qwen2-72B-Instruct, qwen_qwen3.5-122b-a10b, z-ai_glm-5.1",0.0,0.0
78,a pessoa jurídica que optar pelo lucro presumido poderá em algum período de apuração trimestral ser tributada com base no lucro real?,A pessoa jurídica que optar pelo lucro presumido poderá em algum período de  apuração trimestral ser tributada com base no lucro real?,"Sim. Na hipótese de haver pago o imposto com base no lucro presumido e, em relação ao mesmo ano-calendário, incorrer em situação de obrigatoriedade de apuração pelo lucro real por ter auferido lucros, rendimentos ou ganhos de capital oriundos do exterior, deverá apurar o IRPJ e a CSLL sob o regime de apuração pelo lucro real trimestral a partir, inclusive, do trimestre da ocorrência do fato. Tal situação também é possível de ocorrer na hipótese de exclusão do Refis de empresa incluída neste programa como sendo do lucro presumido, embora obrigada ao lucro real.",11,11,0,0,4.757575757575758,4.0,5.0,0.262431940540739,,,"claude-opus-4-6, deepseek-ai_deepseek-v4-flash, gemini-3-pro-preview, google_gemma-4-31b-it, gpt-5.1, meta_llama-3.3-70b-instruct, mistralai_mixtral-8x22b-instruct-v0.1, openai_gpt-oss-120b, qwen2-72B-Instruct, qwen_qwen3.5-122b-a10b, z-ai_glm-5.1",0.0,0.0
79,"existe a possibilidade de serem deduzidas, para fins do imposto de renda, as perdas havidas na alienação de investimentos oriundos de incentivos fiscais?","Existe a possibilidade de serem deduzidas, para fins do imposto de renda, as  perdas havidas na alienação de investimentos oriundos de incentivos fiscais?","Não. A legislação fiscal não admite a dedutibilidade, na apuração do lucro real, da perda de capital decorrente de alienação ou baixa de investimentos adquiridos mediante dedução do imposto de renda devido pela pessoa jurídica, como, por exemplo, os incentivos fiscais para o Finor, Finam e Funres. O valor da perda apurada contabilmente deverá ser adicionado ao lucro líquido, para fins de determinação do lucro real, no Lalur, Parte A.",11,11,0,0,4.757575757575758,4.333333333333333,5.0,0.3674047167570346,,,"claude-opus-4-6, deepseek-ai_deepseek-v4-flash, gemini-3-pro-preview, google_gemma-4-31b-it, gpt-5.1, meta_llama-3.3-70b-instruct, mistralai_mixtral-8x22b-instruct-v0.1, openai_gpt-oss-120b, qwen2-72B-Instruct, qwen_qwen3.5-122b-a10b, z-ai_glm-5.1",0.0,0.0
80,"qual deve ser o tratamento tributário, para fins de determinação do lucro real e do resultado ajustado, para pagamento baseado em ações? em que momento o pagamento baseado em ações poderá ser considerado dedutível?","Qual deve ser o tratamento tributário, para fins de determinação do lucro real  e do resultado ajustado, para pagamento baseado em ações? Em que  momento o pagamento baseado em ações poderá ser considerado dedutível?","O valor da remuneração dos serviços prestados por empregados ou similares, efetuada por meio de acordo com pagamento baseado em ações, deve ser adicionado ao lucro líquido para fins de apuração do lucro real e do resultado ajustado no período de apuração em que o custo ou a despesa forem apropriados. A remuneração dos serviços prestados por empregados ou similares, efetuada por meio de acordo com pagamento baseado em ações, será dedutível somente depois do pagamento, quando liquidados em caixa ou outro ativo, ou depois da transferência da propriedade definitiva das ações ou opções de ações, quando liquidados com instrumentos patrimoniais.",11,11,0,0,4.818181818181818,4.0,5.0,0.1958818671253865,,,"claude-opus-4-6, deepseek-ai_deepseek-v4-flash, gemini-3-pro-preview, google_gemma-4-31b-it, gpt-5.1, meta_llama-3.3-70b-instruct, mistralai_mixtral-8x22b-instruct-v0.1, openai_gpt-oss-120b, qwen2-72B-Instruct, qwen_qwen3.5-122b-a10b, z-ai_glm-5.1",0.0,0.0
81,"de que forma devem ser apurados e registrados os créditos do art. 3º da lei nº 10.637, de 2002, do art. 3º da lei nº 10.833, de 2003, e do arts. 15 e 17 da lei nº 10.865, de 2004, e os demais créditos presumidos da contribuição para o pis/pasep e da cofins?","De que forma devem ser apurados e registrados os créditos do art. 3º da Lei nº  10.637, de 2002, do art. 3º da Lei nº 10.833, de 2003, e do arts. 15 e 17 da Lei nº  10.865, de 2004, e os demais créditos presumidos da Contribuição para o  PIS/Pasep e da Cofins?","As pessoas jurídicas submetidas ao regime de apuração não cumulativa deverão apurar e registrar, de forma segregada, os créditos de que tratam o art. 3º da Lei nº 10.637, de 2002, o art. 3º da Lei nº 10.833, de 2003, e os arts. 15 e 17 da Lei nº 10.865, de 2004, e os créditos presumidos previstos nas Leis da Contribuição para o PIS/Pasep e da Cofins, discriminando-os em função da natureza, origem e vinculação desses créditos, observadas as normas editadas pela Secretaria da Receita Federal do Brasil.",11,11,0,0,4.848484848484849,4.666666666666667,5.0,0.262431940540739,,,"claude-opus-4-6, deepseek-ai_deepseek-v4-flash, gemini-3-pro-preview, google_gemma-4-31b-it, gpt-5.1, meta_llama-3.3-70b-instruct, mistralai_mixtral-8x22b-instruct-v0.1, openai_gpt-oss-120b, qwen2-72B-Instruct, qwen_qwen3.5-122b-a10b, z-ai_glm-5.1",0.0,0.0
82,em que data se considera ocorrida a aquisição ou alienação e quais as condições para que seja aceita?,Em que data se considera ocorrida a aquisição ou alienação e quais as condições  para que seja aceita?,"Considera-se data da aquisição ou alienação aquela em que for celebrado o contrato inicial, ainda que mediante instrumento particular. Caso a transmissão se opere por meio de instrumento particular, a data de aquisição ou alienação constante no respectivo instrumento, se favorável aos interesses da pessoa física, somente será aceita pela autoridade fiscal quando atendida pelo menos uma das seguintes condições: a) o instrumento particular tiver sido registrado no Cartório do Registro Imobiliário, ou no de Títulos e Documentos, no prazo de 30 (trinta) dias, contados da data nele constante; b) houver conformidade com cheque nominativo pago dentro do prazo de 30 (trinta) dias, contados da data do instrumento; c) houver conformidade com lançamentos contábeis da pessoa jurídica, atendidos os preceitos para escrituração em vigor; d) houver menção expressa da operação nas declarações de bens da parte interessada, apresentadas tempestivamente à repartição competente, juntamente com as declarações de rendimentos. 47",11,11,0,0,4.848484848484849,4.666666666666667,5.0,0.262431940540739,,,"claude-opus-4-6, deepseek-ai_deepseek-v4-flash, gemini-3-pro-preview, google_gemma-4-31b-it, gpt-5.1, meta_llama-3.3-70b-instruct, mistralai_mixtral-8x22b-instruct-v0.1, openai_gpt-oss-120b, qwen2-72B-Instruct, qwen_qwen3.5-122b-a10b, z-ai_glm-5.1",0.0,0.0
83,qual o valor que deverá ser considerado para fins de exclusão na determinação do lucro real e do resultado ajustado?,Qual o valor que deverá ser considerado para fins de exclusão na determinação  do lucro real e do resultado ajustado?,"O valor a ser excluído será: I - o efetivamente pago, quando a liquidação baseada em ação for efetuada em caixa ou outro ativo financeiro; ou II - o reconhecido no patrimônio líquido nos termos da legislação comercial, quando a liquidação for efetuada em instrumentos patrimoniais.",11,11,0,0,4.848484848484849,4.666666666666667,5.0,0.262431940540739,,,"claude-opus-4-6, deepseek-ai_deepseek-v4-flash, gemini-3-pro-preview, google_gemma-4-31b-it, gpt-5.1, meta_llama-3.3-70b-instruct, mistralai_mixtral-8x22b-instruct-v0.1, openai_gpt-oss-120b, qwen2-72B-Instruct, qwen_qwen3.5-122b-a10b, z-ai_glm-5.1",0.0,0.0
84,"em caso de alteração das normas em vigor que disciplinam a prática de operações imobiliárias por pessoas físicas, qual a legislação que deverá prevalecer?","Em caso de alteração das normas em vigor que disciplinam a prática de  operações imobiliárias por pessoas físicas, qual a legislação que deverá  prevalecer?","Ocorrendo alteração da legislação, a equiparação será determinada de acordo com as normas legais e regulamentares em vigor na data do instrumento inicial de alienação das unidades imobiliárias ou lotes de terreno (nos casos de incorporações ou loteamentos irregulares), ou do arquivamento dos documentos da incorporação ou do loteamento, quando regulares. A posterior alteração dessas normas não atingirá as operações imobiliárias já realizadas nem os empreendimentos cuja documentação já tenha sido arquivada no Registro Imobiliário.",11,11,0,0,4.878787878787879,4.666666666666667,5.0,0.20994555243259122,,,"claude-opus-4-6, deepseek-ai_deepseek-v4-flash, gemini-3-pro-preview, google_gemma-4-31b-it, gpt-5.1, meta_llama-3.3-70b-instruct, mistralai_mixtral-8x22b-instruct-v0.1, openai_gpt-oss-120b, qwen2-72B-Instruct, qwen_qwen3.5-122b-a10b, z-ai_glm-5.1",0.0,0.0
85,"o valor correspondente à csll será considerado como despesa dedutível, para efeito de determinação do lucro real?","O valor correspondente à CSLL será considerado como despesa dedutível, para  efeito de determinação do lucro real?","Não. O valor da CSLL não pode ser deduzido para efeito da determinação do lucro real, nem da sua própria base de cálculo. O valor da CSLL que for considerado como custo ou despesa deverá ser adicionado ao lucro líquido para efeito de determinação do lucro real.",11,11,0,0,4.878787878787879,4.333333333333333,5.0,0.15745916432444343,,,"claude-opus-4-6, deepseek-ai_deepseek-v4-flash, gemini-3-pro-preview, google_gemma-4-31b-it, gpt-5.1, meta_llama-3.3-70b-instruct, mistralai_mixtral-8x22b-instruct-v0.1, openai_gpt-oss-120b, qwen2-72B-Instruct, qwen_qwen3.5-122b-a10b, z-ai_glm-5.1",0.0,0.0
86,"podem ser consideradas, como custo ou despesa operacional, as aquisições, por empresas que exploram serviços de hotelaria, restaurantes e similares, de guarnições de cama, mesa e banho, e louças?","Podem ser consideradas, como custo ou despesa operacional, as aquisições, por  empresas que exploram serviços de hotelaria, restaurantes e similares, de  guarnições de cama, mesa e banho, e louças?","Sim. Poderá ser computado, como custo ou despesa operacional, o valor da aquisição de guarnições de cama, mesa e banho, e louça, utilizadas por empresas que exploram serviços de hotelaria, restaurantes e atividades similares.",11,11,0,0,4.878787878787879,4.333333333333333,5.0,0.15745916432444343,,,"claude-opus-4-6, deepseek-ai_deepseek-v4-flash, gemini-3-pro-preview, google_gemma-4-31b-it, gpt-5.1, meta_llama-3.3-70b-instruct, mistralai_mixtral-8x22b-instruct-v0.1, openai_gpt-oss-120b, qwen2-72B-Instruct, qwen_qwen3.5-122b-a10b, z-ai_glm-5.1",0.0,0.0
87,onde estavam representados os ativos e passivos mensurados de acordo com os métodos e critérios vigentes em 31 de dezembro de 2007 durante a vigência do rtt? como era gerado o fcont?,Onde estavam representados os ativos e passivos mensurados de acordo com  os métodos e critérios vigentes em 31 de dezembro de 2007 durante a vigência  do RTT? Como era gerado o FCONT?,"Esses ativos e passivos estavam no Controle Fiscal Contábil de Transição (FCONT) de que tratam os arts. 7º e 8º da Instrução Normativa RFB nº 949, de 2009. O FCONT era gerado a partir da contabilidade societária, expurgando e inserindo os lançamentos informados no Programa Validador e Assinador da Entrada de Dados para o Controle Fiscal Contábil de Transição de que trata a Instrução Normativa RFB nº 967, de 2009 (e alterações).",11,11,0,0,4.909090909090909,4.666666666666667,5.0,0.15745916432444343,,,"claude-opus-4-6, deepseek-ai_deepseek-v4-flash, gemini-3-pro-preview, google_gemma-4-31b-it, gpt-5.1, meta_llama-3.3-70b-instruct, mistralai_mixtral-8x22b-instruct-v0.1, openai_gpt-oss-120b, qwen2-72B-Instruct, qwen_qwen3.5-122b-a10b, z-ai_glm-5.1",0.0,0.0
88,os resultados auferidos por filiais e sucursais podem ser consolidados?,Os resultados auferidos por filiais e sucursais podem ser consolidados?,"Desde que as filiais e sucursais sejam domiciliadas num mesmo país, e, tendo a matriz no Brasil indicado uma dessas filiais ou sucursais como entidade líder, os resultados poderão ser consolidados por país, e os prejuízos de uma poderão ser compensados com os lucros da outra.",11,11,0,0,4.909090909090909,4.0,5.0,0.09090909090909091,,,"claude-opus-4-6, deepseek-ai_deepseek-v4-flash, gemini-3-pro-preview, google_gemma-4-31b-it, gpt-5.1, meta_llama-3.3-70b-instruct, mistralai_mixtral-8x22b-instruct-v0.1, openai_gpt-oss-120b, qwen2-72B-Instruct, qwen_qwen3.5-122b-a10b, z-ai_glm-5.1",0.0,0.0
89,"descaracterizada a operação de arrendamento mercantil financeiro, como será determinado o preço de compra e venda?","Descaracterizada a operação de arrendamento mercantil financeiro, como será  determinado o preço de compra e venda?","O preço de compra e venda será o total das contraprestações pagas durante a vigência do arrendamento, acrescido da parcela paga a título de preço de aquisição. ",11,11,0,0,4.96969696969697,4.666666666666667,5.0,0.052486388108147805,,,"claude-opus-4-6, deepseek-ai_deepseek-v4-flash, gemini-3-pro-preview, google_gemma-4-31b-it, gpt-5.1, meta_llama-3.3-70b-instruct, mistralai_mixtral-8x22b-instruct-v0.1, openai_gpt-oss-120b, qwen2-72B-Instruct, qwen_qwen3.5-122b-a10b, z-ai_glm-5.1",0.0,0.0
90,o que é cisão de uma sociedade?,O que é cisão de uma sociedade?,"A cisão é a operação pela qual a sociedade transfere todo ou somente uma parcela do seu patrimônio para uma ou mais sociedades, constituídas para esse fim ou já existentes, extinguindo-se a sociedade cindida, se houver versão de todo o seu patrimônio, ou dividindo-se o seu capital, se parcial a versão.",11,11,0,0,4.96969696969697,4.666666666666667,5.0,0.052486388108147805,,,"claude-opus-4-6, deepseek-ai_deepseek-v4-flash, gemini-3-pro-preview, google_gemma-4-31b-it, gpt-5.1, meta_llama-3.3-70b-instruct, mistralai_mixtral-8x22b-instruct-v0.1, openai_gpt-oss-120b, qwen2-72B-Instruct, qwen_qwen3.5-122b-a10b, z-ai_glm-5.1",0.0,0.0
91,que pessoas jurídicas estão desobrigadas de apresentar a ecf?,Que pessoas jurídicas estão desobrigadas de apresentar a ECF?,"Estão desobrigadas de apresentar a ECF: I - as pessoas jurídicas optantes pelo Regime Especial Unificado de Arrecadação de Tributos e Contribuições devidos pelas Microempresas e Empresas de Pequeno Porte, instituído pela Lei Complementar nº 123, de 14 de dezembro de 2006 (Simples Nacional), por estarem obrigadas à apresentação de Declaração Anual do Simples Nacional - DASN; II - os órgãos públicos, as autarquias e as fundações públicas; e III - as pessoas jurídicas inativas, assim consideradas aquelas que não tenham efetuado qualquer atividade operacional, não operacional, patrimonial ou financeira, inclusive aplicação no mercado financeiro ou de capitais, durante todo o ano-calendário, as quais deverão cumprir as obrigações acessórias previstas na legislação específica.",11,11,0,0,4.96969696969697,4.666666666666667,5.0,0.052486388108147805,,,"claude-opus-4-6, deepseek-ai_deepseek-v4-flash, gemini-3-pro-preview, google_gemma-4-31b-it, gpt-5.1, meta_llama-3.3-70b-instruct, mistralai_mixtral-8x22b-instruct-v0.1, openai_gpt-oss-120b, qwen2-72B-Instruct, qwen_qwen3.5-122b-a10b, z-ai_glm-5.1",0.0,0.0
92,"como deverão ser consideradas as diferenças decorrentes de alterações na taxa de câmbio ocorridas entre a data do fechamento do contrato de câmbio e a data de embarque, para efeito de registro da receita bruta de vendas nas exportações de produtos manufaturados nacionais?","Como deverão ser consideradas as diferenças decorrentes de alterações na taxa  de câmbio ocorridas entre a data do fechamento do contrato de câmbio e a data  de embarque, para efeito de registro da receita bruta de vendas nas exportações  de produtos manufaturados nacionais?","As diferenças decorrentes de alterações na taxa de câmbio ocorridas entre a data do fechamento do contrato de câmbio e a data do embarque devem ser consideradas como variações monetárias ativas ou passivas, conforme o caso.",11,11,0,0,5.0,5.0,5.0,0.0,,,"claude-opus-4-6, deepseek-ai_deepseek-v4-flash, gemini-3-pro-preview, google_gemma-4-31b-it, gpt-5.1, meta_llama-3.3-70b-instruct, mistralai_mixtral-8x22b-instruct-v0.1, openai_gpt-oss-120b, qwen2-72B-Instruct, qwen_qwen3.5-122b-a10b, z-ai_glm-5.1",0.0,0.0
93,"como deverão ser tratados os custos ou despesas operacionais pela adquirente, na hipótese de descaracterização da operação de arrendamento mercantil? adicionalmente, como deverão ser tratados os eventuais tributos não recolhidos?","Como deverão ser tratados os custos ou despesas operacionais pela  adquirente, na hipótese de descaracterização da operação de arrendamento  mercantil? Adicionalmente, como deverão ser tratados os eventuais tributos  não recolhidos?","As importâncias já deduzidas, como custo ou despesa operacional pela adquirente, acrescerão ao lucro tributável, no período de apuração correspondente à respectiva dedução. Adicionalmente, os tributos não recolhidos serão devidos com acréscimos previstos na legislação vigente.",11,11,0,0,5.0,5.0,5.0,0.0,,,"claude-opus-4-6, deepseek-ai_deepseek-v4-flash, gemini-3-pro-preview, google_gemma-4-31b-it, gpt-5.1, meta_llama-3.3-70b-instruct, mistralai_mixtral-8x22b-instruct-v0.1, openai_gpt-oss-120b, qwen2-72B-Instruct, qwen_qwen3.5-122b-a10b, z-ai_glm-5.1",0.0,0.0
