rank_dificuldade,pergunta_norm,pergunta,resposta_oficial,n_modelos,n_correto,n_parcialmente_correto,n_incorreto,score_medio_0_5,score_min,score_max,desvio_medio_entre_julgadores,modelos_incorretos,modelos_parciais,modelos_corretos,taxa_erro,taxa_nao_correto
46,"quais valores devem ser computados na determinação da base de cálculo do pis e da cofins, em operação de arrendamento mercantil, na pessoa jurídica arrendadora?","Quais valores devem ser computados na determinação da base de cálculo do  PIS e da COFINS, em operação de arrendamento mercantil, na pessoa jurídica  arrendadora?","A pessoa jurídica arrendadora deverá computar na apuração da base de cálculo da Contribuição para o PIS/Pasep e da COFINS, o valor da contraprestação de arrendamento mercantil, independentemente de na operação haver transferência substancial dos riscos e benefícios inerentes à propriedade do ativo.",11,6,5,0,4.0,3.333333333333333,5.0,0.9856501576524238,,"gemini-3-pro-preview, google_gemma-4-31b-it, openai_gpt-oss-120b, qwen2-72B-Instruct, qwen_qwen3.5-122b-a10b","claude-opus-4-6, deepseek-ai_deepseek-v4-flash, gpt-5.1, meta_llama-3.3-70b-instruct, mistralai_mixtral-8x22b-instruct-v0.1, z-ai_glm-5.1",0.0,0.45454545454545453
47,o ganho decorrente de avaliação de ativo com base no valor justo integrará a base de cálculo do lucro e resultado presumido?,O ganho decorrente de avaliação de ativo com base no valor justo integrará a  base de cálculo do lucro e resultado presumido?,"Não. A contrapartida do aumento no valor do ativo decorrente de avaliação com base no valor justo não integrará a base de cálculo do lucro e resultado presumido no período de apuração: I - relativo à avaliação com base no valor justo, caso seja registrado diretamente em conta de receita; ou II - em que seja reclassificado como receita, caso seja inicialmente registrado em conta de patrimônio líquido.",11,6,5,0,4.333333333333333,3.333333333333333,5.0,0.262431940540739,,"deepseek-ai_deepseek-v4-flash, mistralai_mixtral-8x22b-instruct-v0.1, openai_gpt-oss-120b, qwen2-72B-Instruct, z-ai_glm-5.1","claude-opus-4-6, gemini-3-pro-preview, google_gemma-4-31b-it, gpt-5.1, meta_llama-3.3-70b-instruct, qwen_qwen3.5-122b-a10b",0.0,0.45454545454545453
48,o ganho decorrente de avaliação de ativo com base no valor justo integrará a base de cálculo do lucro e resultado arbitrado?,O ganho decorrente de avaliação de ativo com base no valor justo integrará a  base de cálculo do lucro e resultado arbitrado?,"Não. A contrapartida do aumento no valor do ativo decorrente de avaliação com base no valor justo não integrará as bases de cálculo do lucro e do resultado arbitrados no período de apuração: I - relativo à avaliação com base no valor justo, caso seja registrado diretamente em conta de receita; ou II - em que seja reclassificado como receita, caso seja inicialmente registrado em conta de patrimônio líquido.",11,7,4,0,4.3939393939393945,3.333333333333333,5.0,0.45378425879906376,,"deepseek-ai_deepseek-v4-flash, mistralai_mixtral-8x22b-instruct-v0.1, openai_gpt-oss-120b, qwen2-72B-Instruct","claude-opus-4-6, gemini-3-pro-preview, google_gemma-4-31b-it, gpt-5.1, meta_llama-3.3-70b-instruct, qwen_qwen3.5-122b-a10b, z-ai_glm-5.1",0.0,0.36363636363636365
49,"como deve ser apurado o limite admitido de compensação do tributo pago no exterior sobre lucros auferidos por meio de controladas, coligadas, filiais ou sucursais?","Como deve ser apurado o limite admitido de compensação do tributo pago no  exterior sobre lucros auferidos por meio de controladas, coligadas, filiais ou  sucursais?","A pessoa jurídica deverá calcular o valor: a) do imposto pago no exterior, correspondente aos lucros de cada filial, sucursal, controlada ou coligada, bem assim aos rendimentos e ganhos de capital, que foram computados na determinação do lucro real; b) do imposto sobre a renda e CSLL devidos sobre o lucro real antes e após a inclusão dos lucros auferidos no exterior. O imposto, passível de compensação, não poderá exceder o valor determinado na letra “a” anterior, nem à diferença positiva entre os valores calculados sobre o lucro real com e sem a inclusão dos referidos lucros, rendimentos ou ganhos de capital auferidos no exterior e referidos na letra “b”.",11,8,3,0,4.121212121212121,3.0,5.0,1.00300715737428,,"gpt-5.1, qwen2-72B-Instruct, qwen_qwen3.5-122b-a10b","claude-opus-4-6, deepseek-ai_deepseek-v4-flash, gemini-3-pro-preview, google_gemma-4-31b-it, meta_llama-3.3-70b-instruct, mistralai_mixtral-8x22b-instruct-v0.1, openai_gpt-oss-120b, z-ai_glm-5.1",0.0,0.2727272727272727
50,quais são os gastos com a implantação de uma indústria que deverão ser considerados como “despesas pré-operacionais”?,Quais são os gastos com a implantação de uma indústria que deverão ser  considerados como “despesas pré-operacionais”?,"Todas as despesas necessárias à organização e implantação ou ampliação de empresas, inclusive aquelas de cunho administrativo, pagas ou incorridas até o início de suas operações ou plena utilização das instalações, são pré-operacionais ou pré-industriais. A empresa deverá imobilizar as aquisições de bens e direitos, classificáveis no ativo permanente, e lançar em despesas pré-operacionais as despesas, respeitando, sempre, as condições gerais de dedutibilidade e os limites estabelecidos pela legislação tributária, já que estes limites são válidos tanto para as despesas operacionais quanto para as pré-operacionais.",11,8,3,0,4.181818181818182,3.0,5.0,0.6157729719905689,,"claude-opus-4-6, deepseek-ai_deepseek-v4-flash, openai_gpt-oss-120b","gemini-3-pro-preview, google_gemma-4-31b-it, gpt-5.1, meta_llama-3.3-70b-instruct, mistralai_mixtral-8x22b-instruct-v0.1, qwen2-72B-Instruct, qwen_qwen3.5-122b-a10b, z-ai_glm-5.1",0.0,0.2727272727272727
51,quando se considera devido o adicional do irpj e qual a alíquota aplicável no seu cálculo?,Quando se considera devido o adicional do IRPJ e qual a alíquota aplicável no  seu cálculo?,"Sobre a parcela do lucro real, presumido ou arbitrado que exceder o valor resultante da multiplicação de R$ 20.000,00 (vinte mil reais) pelo número de meses do respectivo período de apuração, o adicional incidirá à alíquota de dez por cento. Aplica-se esse adicional, inclusive, na exploração da atividade rural e, também, nas hipóteses de incorporação, fusão e cisão.",11,9,2,0,4.03030303030303,3.0,4.333333333333333,0.5108001957742734,,"gemini-3-pro-preview, gpt-5.1","claude-opus-4-6, deepseek-ai_deepseek-v4-flash, google_gemma-4-31b-it, meta_llama-3.3-70b-instruct, mistralai_mixtral-8x22b-instruct-v0.1, openai_gpt-oss-120b, qwen2-72B-Instruct, qwen_qwen3.5-122b-a10b, z-ai_glm-5.1",0.0,0.18181818181818182
52,quais são os níveis de detalhamento e as características das subcontas?,Quais são os níveis de detalhamento e as características das subcontas?,"As subcontas serão analíticas e registrarão os lançamentos contábeis das diferenças em último nível. Cada subconta deve se referir a apenas uma única conta de ativo ou passivo, e cada conta de ativo ou passivo referir-se-á a apenas uma subconta. O conjunto de contas formado pela conta analítica do ativo ou passivo e as subcontas correlatas receberá identificação única, que não poderá ser alterada até o encerramento contábil das subcontas.",11,9,2,0,4.181818181818182,3.6666666666666665,4.666666666666667,0.8839706958507798,,"gemini-3-pro-preview, meta_llama-3.3-70b-instruct","claude-opus-4-6, deepseek-ai_deepseek-v4-flash, google_gemma-4-31b-it, gpt-5.1, mistralai_mixtral-8x22b-instruct-v0.1, openai_gpt-oss-120b, qwen2-72B-Instruct, qwen_qwen3.5-122b-a10b, z-ai_glm-5.1",0.0,0.18181818181818182
53,qual deve ser o procedimento adotado pelo contribuinte no caso de contrato de concessão de serviços públicos na adoção inicial?,Qual deve ser o procedimento adotado pelo contribuinte no caso de contrato  de concessão de serviços públicos na adoção inicial?,"No caso de contrato de concessão de serviços públicos, o contribuinte deverá: 1) calcular o resultado tributável do contrato de concessão acumulado até a data da adoção inicial, considerando os métodos e critérios vigentes em 31 de dezembro de 2007; 2) calcular o resultado tributável do contrato de concessão acumulado até a data da adoção inicial, considerando as disposições da Instrução Normativa RFB nº 1.700/2017 e da Lei nº 6.404, de 1976; 3) calcular a diferença entre os valores referidos nos itens 1 e 2 acima, que deverá ser controlada na Parte B do e-Lalur e do e-Lacs; e 4) adicionar, se negativa, ou excluir, se positiva, a diferença referida no item 3 acima na apuração do lucro real e do resultado ajustado em quotas fixas mensais durante o prazo restante de vigência do contrato. O contribuinte deverá conservar os documentos comprobatórios da diferença enquanto os períodos de apuração abrangidos pelo contrato estiverem sujeitos a verificação por parte da Secretaria Especial da Receita Federal do Brasil. 774",11,9,2,0,4.636363636363637,3.6666666666666665,5.0,0.262431940540739,,"mistralai_mixtral-8x22b-instruct-v0.1, qwen2-72B-Instruct","claude-opus-4-6, deepseek-ai_deepseek-v4-flash, gemini-3-pro-preview, google_gemma-4-31b-it, gpt-5.1, meta_llama-3.3-70b-instruct, openai_gpt-oss-120b, qwen_qwen3.5-122b-a10b, z-ai_glm-5.1",0.0,0.18181818181818182
54,"como deverão ser convertidos os lucros auferidos no exterior por intermédio de filiais, sucursais, controladas ou coligadas?","Como deverão ser convertidos os lucros auferidos no exterior por intermédio de  filiais, sucursais, controladas ou coligadas?","Os lucros auferidos no exterior por intermédio de filiais, sucursais, controladas ou coligadas serão convertidos em Reais pela taxa de câmbio, para venda, do dia das demonstrações financeiras em que tenham sido apurados os correspondentes lucros.",11,10,1,0,4.0606060606060606,3.0,4.333333333333333,0.8744365594106369,,gemini-3-pro-preview,"claude-opus-4-6, deepseek-ai_deepseek-v4-flash, google_gemma-4-31b-it, gpt-5.1, meta_llama-3.3-70b-instruct, mistralai_mixtral-8x22b-instruct-v0.1, openai_gpt-oss-120b, qwen2-72B-Instruct, qwen_qwen3.5-122b-a10b, z-ai_glm-5.1",0.0,0.09090909090909091
55,"em que consiste a exaustão, em termos contábeis?","Em que consiste a exaustão, em termos contábeis?","Exaurir significa esgotar completamente. Em termos contábeis, a exaustão se relaciona com a perda de valor dos bens ou direitos do ativo, ao longo do tempo, decorrentes de sua exploração (extração ou aproveitamento).",11,10,1,0,4.151515151515151,3.6666666666666665,5.0,0.7508705490200748,,claude-opus-4-6,"deepseek-ai_deepseek-v4-flash, gemini-3-pro-preview, google_gemma-4-31b-it, gpt-5.1, meta_llama-3.3-70b-instruct, mistralai_mixtral-8x22b-instruct-v0.1, openai_gpt-oss-120b, qwen2-72B-Instruct, qwen_qwen3.5-122b-a10b, z-ai_glm-5.1",0.0,0.09090909090909091
56,como as empresas não imobiliárias devem classificar a conta representativa de “construções em andamento”?,Como as empresas não imobiliárias devem classificar a conta representativa de  “construções em andamento”?,"Para as empresas que não explorem a atividade imobiliária, as aplicações que representem construções em andamento devem ser classificadas em conta do ativo permanente (imobilizado). No caso de empreendimento que envolva a construção de bens de naturezas diversas, a empresa deverá fazer a distribuição contábil dos acréscimos de maneira a permitir, ao término da construção, a correta identificação de cada bem, segundo sua natureza e as taxas anuais de depreciação a eles aplicáveis.",11,10,1,0,4.181818181818182,3.0,4.666666666666667,0.6017092866833642,,openai_gpt-oss-120b,"claude-opus-4-6, deepseek-ai_deepseek-v4-flash, gemini-3-pro-preview, google_gemma-4-31b-it, gpt-5.1, meta_llama-3.3-70b-instruct, mistralai_mixtral-8x22b-instruct-v0.1, qwen2-72B-Instruct, qwen_qwen3.5-122b-a10b, z-ai_glm-5.1",0.0,0.09090909090909091
57,como serão tributados no brasil os lucros auferidos no exterior por intermédio de filiais e sucursais da pessoa jurídica no brasil?,Como serão tributados no Brasil os lucros auferidos no exterior por intermédio  de filiais e sucursais da pessoa jurídica no Brasil?,"Para fins de apuração do lucro real e da base de cálculo da CSLL, os lucros auferidos por filiais e sucursais no exterior serão adicionados integralmente ao lucro líquido da pessoa jurídica no Brasil em 31 de dezembro do ano-calendário em que tiverem sido disponibilizados.",11,10,1,0,4.363636363636363,3.6666666666666665,4.666666666666667,0.8071252902488937,,gemini-3-pro-preview,"claude-opus-4-6, deepseek-ai_deepseek-v4-flash, google_gemma-4-31b-it, gpt-5.1, meta_llama-3.3-70b-instruct, mistralai_mixtral-8x22b-instruct-v0.1, openai_gpt-oss-120b, qwen2-72B-Instruct, qwen_qwen3.5-122b-a10b, z-ai_glm-5.1",0.0,0.09090909090909091
58,"quais as alíquotas aplicáveis sobre o lucro, para determinar o imposto de renda devido pela pessoa jurídica em cada período de apuração?","Quais as alíquotas aplicáveis sobre o lucro, para determinar o imposto de renda  devido pela pessoa jurídica em cada período de apuração?","A partir do ano-calendário de 1996, as pessoas jurídicas, independentemente da forma de constituição e da natureza da atividade exercida, passaram a pagar o imposto de renda à alíquota de quinze por cento, incidente sobre a base de cálculo apurada na forma do lucro real, presumido ou arbitrado.",11,10,1,0,4.3939393939393945,3.6666666666666665,4.666666666666667,0.7546389021407459,,mistralai_mixtral-8x22b-instruct-v0.1,"claude-opus-4-6, deepseek-ai_deepseek-v4-flash, gemini-3-pro-preview, google_gemma-4-31b-it, gpt-5.1, meta_llama-3.3-70b-instruct, openai_gpt-oss-120b, qwen2-72B-Instruct, qwen_qwen3.5-122b-a10b, z-ai_glm-5.1",0.0,0.09090909090909091
59,"na ocorrência da adoção de novo método ou critério contábil, os contribuintes já estão autorizados a fazer os referidos ajustes na apuração do lucro real, da base de cálculo da csll, da cofins e do pis, até que a lei tributária regule a matéria? ou o contribuinte precisa de uma norma da rfb autorizando efetuar tais ajustes?","Na ocorrência da adoção de novo método ou critério contábil, os contribuintes  já estão autorizados a fazer os referidos ajustes na apuração do lucro real, da  base de cálculo da CSLL, da COFINS e do PIS, até que a lei tributária regule a  matéria? Ou o contribuinte precisa de uma norma da RFB autorizando efetuar  tais ajustes?","Não. Quando houver modificação ou adoção de novo método ou critério contábil por meio de ato administrativo emitido com base em competência atribuída em lei comercial, a Secretaria Especial da Receita Federal do Brasil irá dispor sobre os procedimentos para anular os efeitos desses atos.",11,10,1,0,4.545454545454546,3.333333333333333,5.0,0.4583138076661255,,openai_gpt-oss-120b,"claude-opus-4-6, deepseek-ai_deepseek-v4-flash, gemini-3-pro-preview, google_gemma-4-31b-it, gpt-5.1, meta_llama-3.3-70b-instruct, mistralai_mixtral-8x22b-instruct-v0.1, qwen2-72B-Instruct, qwen_qwen3.5-122b-a10b, z-ai_glm-5.1",0.0,0.09090909090909091
60,"qual o tratamento tributário dispensado à receita decorrente da venda de bens classificados no grupo de ""ativo não circulante mantido para venda"", quando pessoa jurídica sujeita ao regime não cumulativo?","Qual o tratamento tributário dispensado à receita decorrente da venda de  bens classificados no grupo de ""ativo não circulante mantido para venda"",  quando pessoa jurídica sujeita ao regime não cumulativo?","Não integram a base de cálculo da Contribuição para o PIS/Pasep e da COFINS apurados no regime de incidência não-cumulativa a que se referem a Lei nº 10.637, de 2002, e a Lei nº 10.833, de 2003, as outras receitas, decorrentes da venda de bens do ativo não circulante, classificado como investimento, imobilizado ou intangível. Tal disposição se aplica inclusive no caso do bem ter sido reclassificado para o Ativo Circulante com intenção de venda, por força das normas contábeis e da legislação comercial.",11,10,1,0,4.757575757575758,3.6666666666666665,5.0,0.262431940540739,,meta_llama-3.3-70b-instruct,"claude-opus-4-6, deepseek-ai_deepseek-v4-flash, gemini-3-pro-preview, google_gemma-4-31b-it, gpt-5.1, mistralai_mixtral-8x22b-instruct-v0.1, openai_gpt-oss-120b, qwen2-72B-Instruct, qwen_qwen3.5-122b-a10b, z-ai_glm-5.1",0.0,0.09090909090909091
61,como deverão ser tratados os reajustes posteriores à época do recebimento do bem adquirido por meio de consórcio?,Como deverão ser tratados os reajustes posteriores à época do recebimento do  bem adquirido por meio de consórcio?,"As variações do saldo devedor que ocorrerem no futuro, decorrentes da modificação no valor das prestações, serão refletidas nas contas que registram a obrigação, sendo sua contrapartida considerada como variação monetária passiva (ou ativa).",11,10,1,0,4.787878787878788,3.0,5.0,0.20994555243259116,,openai_gpt-oss-120b,"claude-opus-4-6, deepseek-ai_deepseek-v4-flash, gemini-3-pro-preview, google_gemma-4-31b-it, gpt-5.1, meta_llama-3.3-70b-instruct, mistralai_mixtral-8x22b-instruct-v0.1, qwen2-72B-Instruct, qwen_qwen3.5-122b-a10b, z-ai_glm-5.1",0.0,0.09090909090909091
62,"na apuração do ganho de capital na alienação de investimento, imobilizado ou intangível a ser acrescido à base de cálculo do lucro e do resultado arbitrado, o aumento no valor do ativo decorrente de avaliação com base no valor justo pode ser considerado como parte integrante do valor contábil?","Na apuração do ganho de capital na alienação de investimento, imobilizado ou  intangível a ser acrescido à base de cálculo do lucro e do resultado arbitrado,  o aumento no valor do ativo decorrente de avaliação com base no valor justo  pode ser considerado como parte integrante do valor contábil?","Não, exceto se o ganho relativo à avaliação com base no valor justo tenha sido anteriormente computado na base de cálculo do tributo.",11,10,1,0,4.818181818181818,3.333333333333333,5.0,0.10497277621629561,,mistralai_mixtral-8x22b-instruct-v0.1,"claude-opus-4-6, deepseek-ai_deepseek-v4-flash, gemini-3-pro-preview, google_gemma-4-31b-it, gpt-5.1, meta_llama-3.3-70b-instruct, openai_gpt-oss-120b, qwen2-72B-Instruct, qwen_qwen3.5-122b-a10b, z-ai_glm-5.1",0.0,0.09090909090909091
63,como os direitos sujeitos à exaustão serão apresentados no balanço?,Como os direitos sujeitos à exaustão serão apresentados no balanço?,"No balanço, os direitos serão classificados no ativo imobilizado e deverão ser avaliados pelo custo de aquisição, deduzido do saldo da respectiva conta de exaustão acumulada.",11,11,0,0,4.303030303030304,4.0,5.0,0.20994555243259122,,,"claude-opus-4-6, deepseek-ai_deepseek-v4-flash, gemini-3-pro-preview, google_gemma-4-31b-it, gpt-5.1, meta_llama-3.3-70b-instruct, mistralai_mixtral-8x22b-instruct-v0.1, openai_gpt-oss-120b, qwen2-72B-Instruct, qwen_qwen3.5-122b-a10b, z-ai_glm-5.1",0.0,0.0
64,o lucro apurado periodicamente pela pessoa física equiparada à pessoa jurídica em razão de operações com imóveis pode ser mantido como lucros suspensos na escrituração da pessoa jurídica?,O lucro apurado periodicamente pela pessoa física equiparada à pessoa jurídica  em razão de operações com imóveis pode ser mantido como lucros suspensos  na escrituração da pessoa jurídica?,"Não. Esse lucro, após a dedução da provisão para pagamento do IRPJ, sempre será considerado como automaticamente distribuído no período de apuração em que for apurado.",11,11,0,0,4.363636363636363,4.0,5.0,0.6017092866833642,,,"claude-opus-4-6, deepseek-ai_deepseek-v4-flash, gemini-3-pro-preview, google_gemma-4-31b-it, gpt-5.1, meta_llama-3.3-70b-instruct, mistralai_mixtral-8x22b-instruct-v0.1, openai_gpt-oss-120b, qwen2-72B-Instruct, qwen_qwen3.5-122b-a10b, z-ai_glm-5.1",0.0,0.0
65,"no que tange à elaboração da escrituração contábil, quais requisitos deverão ser observados? como tal escrituração será formalizada para fins de fiscalização?","No que tange à elaboração da escrituração contábil,  quais requisitos deverão ser observados? Como tal escrituração será  formalizada para fins de fiscalização?","A escrituração contábil elaborada para atendimento à legislação tributária deverá conter todos os fatos contábeis do período de apuração, devendo ser elaborada em forma contábil e com a utilização do plano de contas da escrituração comercial. Os lançamentos realizados nesta escrituração contábil deverão, nos casos em que couber, manter correspondência com aqueles efetuados na escrituração comercial, inclusive no que se refere aos históricos. A escrituração contábil será transmitida ao Sped.",11,11,0,0,4.393939393939394,4.0,5.0,0.6401319894843074,,,"claude-opus-4-6, deepseek-ai_deepseek-v4-flash, gemini-3-pro-preview, google_gemma-4-31b-it, gpt-5.1, meta_llama-3.3-70b-instruct, mistralai_mixtral-8x22b-instruct-v0.1, openai_gpt-oss-120b, qwen2-72B-Instruct, qwen_qwen3.5-122b-a10b, z-ai_glm-5.1",0.0,0.0
66,qual é o valor da parcela do investimento referente ao lucro ou prejuízo de investimento no exterior que deve ser registrada na subconta de investimento?,Qual é o valor da parcela do investimento referente ao lucro ou prejuízo de  investimento no exterior que deve ser registrada na subconta de investimento?,"O valor a ser registrado na subconta de investimento é o equivalente aos lucros ou prejuízos antes da tributação no exterior sobre tais lucros ou prejuízos, assim entendido como o lucro ou prejuízo antes dos tributos sobre a renda, sejam correntes e/ou diferidos.",11,11,0,0,4.393939393939394,4.0,5.0,0.41989110486518244,,,"claude-opus-4-6, deepseek-ai_deepseek-v4-flash, gemini-3-pro-preview, google_gemma-4-31b-it, gpt-5.1, meta_llama-3.3-70b-instruct, mistralai_mixtral-8x22b-instruct-v0.1, openai_gpt-oss-120b, qwen2-72B-Instruct, qwen_qwen3.5-122b-a10b, z-ai_glm-5.1",0.0,0.0
67,o contribuinte pode efetuar a exclusão da diferença negativa entre o saldo do ativo diferido registrado na contabilidade societária e no fcont?,O contribuinte pode efetuar a exclusão da diferença negativa entre o saldo do  ativo diferido registrado na contabilidade societária e no FCONT?,"A diferença negativa verificada na data da adoção inicial entre o valor de ativo diferido na contabilidade societária e no FCONT somente poderá ser excluída se o contribuinte evidenciar essa diferença em subconta vinculada ao ativo. A diferença poderá ser controlada de duas formas: 1) por meio da utilização de uma única subconta, sendo o lançamento a crédito na subconta e a débito na conta de ativo diferido; 2) por meio da utilização de 2 (duas) subcontas, sendo o lançamento a crédito na subconta vinculada ao ativo diferido e a débito em uma subconta auxiliar à subconta vinculada ao ativo. A diferença poderá ser excluída em cada período de apuração proporcionalmente à parcela equivalente à amortização do ativo diferido de acordo com as normas e critérios tributários vigentes em 31 de dezembro de 2007. No caso de ativo diferido não reconhecido na data da adoção inicial na contabilidade societária, mas reconhecido no FCONT, a diferença deverá ser controlada na Parte B do e-Lalur e do e-Lacs.",11,11,0,0,4.424242424242424,4.0,5.0,0.262431940540739,,,"claude-opus-4-6, deepseek-ai_deepseek-v4-flash, gemini-3-pro-preview, google_gemma-4-31b-it, gpt-5.1, meta_llama-3.3-70b-instruct, mistralai_mixtral-8x22b-instruct-v0.1, openai_gpt-oss-120b, qwen2-72B-Instruct, qwen_qwen3.5-122b-a10b, z-ai_glm-5.1",0.0,0.0
68,"qual o regime de tributação da pessoa jurídica que auferir lucros, rendimentos e ganhos de capital do exterior?","Qual o regime de tributação da pessoa jurídica que auferir lucros, rendimentos  e ganhos de capital do exterior?","A pessoa jurídica que auferir lucros, rendimentos ou ganhos de capital do exterior fica obrigada à tributação com base no lucro real, a partir, inclusive, do trimestre de sua ocorrência.",11,11,0,0,4.515151515151515,4.0,5.0,0.47237749297333026,,,"claude-opus-4-6, deepseek-ai_deepseek-v4-flash, gemini-3-pro-preview, google_gemma-4-31b-it, gpt-5.1, meta_llama-3.3-70b-instruct, mistralai_mixtral-8x22b-instruct-v0.1, openai_gpt-oss-120b, qwen2-72B-Instruct, qwen_qwen3.5-122b-a10b, z-ai_glm-5.1",0.0,0.0
69,os rendimentos e ganhos de capital auferidos no exterior sujeitam-se à incidência da csll?,Os rendimentos e ganhos de capital auferidos no exterior sujeitam-se à  incidência da CSLL?,"Sim. O art. 21 da MP nº 2.158-35, de 2001, determina que os lucros, rendimentos e ganhos de capital auferidos no exterior ficam sujeitos à incidência da CSLL, observadas as normas de tributação universal. O parágrafo único do mencionado artigo, por seu turno, preconiza que o saldo do imposto de renda pago no exterior, que exceder o valor compensável com o IRPJ devido no Brasil, poderá ser compensado com a CSLL devida em virtude da adição, à sua base de cálculo, dos lucros oriundos do exterior, até o limite acrescido em decorrência dessa adição.",11,11,0,0,4.545454545454546,4.0,4.666666666666667,0.7348094335140692,,,"claude-opus-4-6, deepseek-ai_deepseek-v4-flash, gemini-3-pro-preview, google_gemma-4-31b-it, gpt-5.1, meta_llama-3.3-70b-instruct, mistralai_mixtral-8x22b-instruct-v0.1, openai_gpt-oss-120b, qwen2-72B-Instruct, qwen_qwen3.5-122b-a10b, z-ai_glm-5.1",0.0,0.0
