Q,A,A_model
"Podem ser consideradas, como custo ou despesa operacional, as aquisições, por  empresas que exploram serviços de hotelaria, restaurantes e similares, de  guarnições de cama, mesa e banho, e louças?","Sim. Poderá ser computado, como custo ou despesa operacional, o valor da aquisição de guarnições de cama, mesa e banho, e louça, utilizadas por empresas que exploram serviços de hotelaria, restaurantes e atividades similares.","Sim, as aquisições de guarnições de cama, mesa e banho e de louças por empresas que exploram serviços de hotelaria, restaurantes e atividades similares podem ser computadas como custo ou despesa operacional."
"Como deverão ser consideradas as diferenças decorrentes de alterações na taxa  de câmbio ocorridas entre a data do fechamento do contrato de câmbio e a data  de embarque, para efeito de registro da receita bruta de vendas nas exportações  de produtos manufaturados nacionais?","As diferenças decorrentes de alterações na taxa de câmbio ocorridas entre a data do fechamento do contrato de câmbio e a data do embarque devem ser consideradas como variações monetárias ativas ou passivas, conforme o caso.","As diferenças decorrentes de alteração na taxa de câmbio, ocorridas entre a data do fechamento do contrato de câmbio e a data do embarque, serão consideradas como variações monetárias passivas ou ativas."
"Em que consiste a exaustão, em termos contábeis?","Exaurir significa esgotar completamente. Em termos contábeis, a exaustão se relaciona com a perda de valor dos bens ou direitos do ativo, ao longo do tempo, decorrentes de sua exploração (extração ou aproveitamento).","A exaustão consiste na perda de valor decorrente da exploração de direitos cujo objeto sejam recursos minerais ou florestais, ou bens aplicados nessa exploração."
Como os direitos sujeitos à exaustão serão apresentados no balanço?,"No balanço, os direitos serão classificados no ativo imobilizado e deverão ser avaliados pelo custo de aquisição, deduzido do saldo da respectiva conta de exaustão acumulada.","Os direitos sujeitos à exaustão serão apresentados no balanço pelo custo de aquisição, deduzido do saldo da respectiva conta de exaustão."
Como deve proceder o contribuinte que deixou de contabilizar ou contabilizou  a menor o valor da provisão para o imposto sobre a renda?,"Deve, no curso do período de apuração seguinte, mediante lançamento de ajuste em contas próprias, com efeitos retroativos ao início do período de apuração, regularizar sua situação contábil pelo registro do valor da provisão (ou da diferença a menor apurada), a débito de conta do patrimônio líquido (prejuízos acumulados).",Eu não sei a resposta.
As sociedades por ações poderão ter quantos conselheiros fiscais?,"O conselho fiscal será composto de, no mínimo, 3 (três), e no máximo, 5 (cinco) membros, e suplentes em igual número, acionistas ou não, eleitos pela assembleia- geral.","As sociedades por ações poderão ter no mínimo 3 e no máximo 5 conselheiros fiscais titulares, e igual número de suplentes."
"Existe a possibilidade de serem deduzidas, para fins do imposto de renda, as  perdas havidas na alienação de investimentos oriundos de incentivos fiscais?","Não. A legislação fiscal não admite a dedutibilidade, na apuração do lucro real, da perda de capital decorrente de alienação ou baixa de investimentos adquiridos mediante dedução do imposto de renda devido pela pessoa jurídica, como, por exemplo, os incentivos fiscais para o Finor, Finam e Funres. O valor da perda apurada contabilmente deverá ser adicionado ao lucro líquido, para fins de determinação do lucro real, no Lalur, Parte A.","Não, não é possível deduzir as perdas apuradas na alienação ou na baixa de investimentos adquiridos por meio de dedução do imposto de renda devido pela pessoa jurídica para fins de determinação do lucro real."
Qual o tratamento tributário aplicável ao prejuízo fiscal apurado por Sociedade  em Conta de Participação (SCP)?,"O prejuízo fiscal apurado por Sociedade em Conta de Participação (SCP), somente poderá ser compensado com o lucro real decorrente da mesma SCP. É vedada a compensação de prejuízos fiscais e lucros entre duas ou mais SCP, ou entre estas e o sócio ostensivo.",O prejuízo fiscal apurado por uma Sociedade em Conta de Participação (SCP) somente poderá ser compensado com o lucro real decorrente da mesma SCP. É vedada a compensação de prejuízos fiscais e lucros entre duas ou mais SCPs ou entre estas e o sócio ostensivo.
"A pessoa jurídica que tiver prejuízo fiscal de períodos de apuração anteriores  devidamente apurado e controlado no Lalur, vindo a se submeter à tributação  utilizando-se de outra base que não a do lucro real, perderá o direito de  compensar este prejuízo?","O direito à compensação dos prejuízos fiscais, desde que estejam devidamente apurados e controlados na parte B do Lalur, somente poderá ser exercido quando a pessoa jurídica for tributada com base no lucro real, pois quando a forma de tributação for outra não há que se falar em apurar ou compensar prejuízos fiscais. Esse direito, entretanto, não será prejudicado ainda que o contribuinte possa, em algum período de apuração, ter sido tributado com base no lucro presumido ou arbitrado. Assim, no período-base em que retornar à tributação com base no lucro real poderá compensar o prejuízo fiscal constante no Lalur, Parte B, observada a legislação vigente à época da compensação.","Não perderá o direito de compensar o prejuízo fiscal. Caso a pessoa jurídica retorne ao regime de tributação pelo lucro real, o saldo de prejuízos fiscais remanescente e não utilizado poderá vir a ser compensado, observados os prazos e as normas pertinentes à compensação."
A absorção na escrituração comercial de prejuízos contábeis impede a  compensação dos prejuízos fiscais?,"A absorção na escrituração comercial de prejuízos contábeis apurados mediante débito à conta de lucros acumulados, de reservas de lucros ou de capital, ao capital social, ou à conta de sócios, matriz ou titular de empresa individual, não impede a compensação dos prejuízos fiscais.","A absorção de prejuízos contábeis na escrituração comercial não impede a compensação dos prejuízos fiscais, desde que o procedimento contábil seja regular e esteja em conformidade com as normas e padrões de Contabilidade geralmente aceitos. 

Para que a eliminação do prejuízo seja havida como regular e não influencie de forma indevida a determinação do lucro real e o saldo da conta de correção monetária, é necessário que ela equivalha a um aporte de capital. Isso ocorre quando há um débito à conta do sócio com saldo credor suficiente, o que mantém a integridade do capital social.

No entanto, se a absorção do prejuízo for feita por meio de débito à conta do sócio sem que haja saldo credor suficiente, o procedimento é considerado inidôneo para elevar o valor do patrimônio líquido. Nessa hipótese, o prejuízo eliminado graficamente será substituído por igual parcela redutora de capital a realizar, o que obriga a pessoa jurídica a deduzir do patrimônio líquido, para cálculo da correção monetária, o valor indevidamente acrescido."
"A pessoa jurídica que explora atividade rural e que tenha utilizado o benefício  fiscal da depreciação incentivada, ao mudar para o regime de tributação do lucro  presumido ou arbitrado deve adicionar à base de cálculo do imposto de renda o  saldo dessa depreciação?","Não. A reversão da depreciação incentivada que deve ser adicionado ao lucro líquido para determinação do lucro real e controlada na Parte B do e-Lalur e na Parte B do e- Lacs, não é a decorrente de tributação diferida, uma vez que a adição se impõe em virtude de anular os efeitos decorrentes da depreciação normal consignada na escrituração comercial da pessoa jurídica rural. No regime de tributação do lucro presumido ou arbitrado, prescinde-se da escrita regular, e, em consequência, não há o aludido efeito de depreciação normal a ser compensado pela adição.","Sim. De acordo com o Art. 265, a pessoa jurídica rural que utiliza qualquer incentivo aplicável à atividade não pode optar pela tributação com base no lucro presumido. Portanto, se a empresa utilizou o benefício fiscal da depreciação incentivada, ela não está autorizada a mudar para o regime do lucro presumido ou arbitrado. Para que a mudança de regime seja possível, a empresa precisa eliminar a utilização do incentivo, o que é feito mediante a adição do saldo dessa depreciação à base de cálculo do imposto de renda, revertendo o benefício fiscal anteriormente utilizado."
Pessoa jurídica que retornar ao lucro real poderá fazer jus à depreciação  acelerada incentivada?,"Sim. Retornando à tributação com base no lucro real a pessoa jurídica deverá adicionar o encargo de depreciação normal registrado na escrituração comercial, relativo a bens já totalmente depreciados, ao resultado da atividade rural, efetuando a baixa do respectivo valor no saldo da depreciação incentivada controlado na Parte B do e-Lalur e do e-Lacs.","Sim. Ao retornar à tributação com base no lucro real, a pessoa jurídica rural deverá adicionar ao resultado líquido o encargo de depreciação normal registrado na escrituração comercial relativo a bens já totalmente depreciados, efetuando a baixa desse valor no saldo da depreciação incentivada controlado na parte B do e-Lalur e do e-Lacs. Além disso, se um bem que havia sido desviado para outras atividades retornar à produção rural própria, a pessoa jurídica poderá voltar a fazer jus ao benefício da depreciação incentivada, excluindo do resultado líquido a diferença entre o custo de aquisição do bem e a depreciação acumulada até a época."
"Como deverá proceder a pessoa jurídica que explora atividade rural com  tributação pelo lucro real e, posteriormente, venha a optar pela tributação com  base no lucro presumido ou arbitrado, e vier a alienar o bem depreciado com o  incentivo fiscal?","A pessoa jurídica rural que tiver usufruído o benefício fiscal da depreciação acelerada incentivada, vindo, posteriormente, a ser tributada pelo lucro presumido ou arbitrado, caso aliene o bem depreciado com o incentivo durante a permanência nesses regimes, deverá adicionar à base de cálculo para determinação do lucro presumido ou arbitrado o saldo remanescente da depreciação não realizada.",A pessoa jurídica rural deverá adicionar à base de cálculo para determinação do lucro presumido e do resultado presumido o saldo remanescente da depreciação não realizada.
Poderá haver mudança da opção para o contribuinte que já efetuou o  recolhimento da primeira quota ou de quota única com base no lucro  presumido?,"Como regra, não há a possibilidade de mudança. A opção pela tributação com base no lucro presumido será definitiva em relação a todo o ano-calendário. Todavia, abre-se exceção quando ocorrer qualquer das hipóteses de arbitramento previstas na legislação tributária, situação em que a pessoa jurídica poderá, desde que conhecida a receita bruta, determinar o lucro tributável segundo as regras relativas ao regime de tributação com base no lucro arbitrado.","Não, não poderá haver mudança. A opção pela tributação com base no lucro presumido é definitiva em relação a todo o ano-calendário, sendo manifestada justamente com o pagamento da primeira quota ou quota única do imposto devido."
A pessoa jurídica que optar pelo lucro presumido poderá em algum período de  apuração trimestral ser tributada com base no lucro real?,"Sim. Na hipótese de haver pago o imposto com base no lucro presumido e, em relação ao mesmo ano-calendário, incorrer em situação de obrigatoriedade de apuração pelo lucro real por ter auferido lucros, rendimentos ou ganhos de capital oriundos do exterior, deverá apurar o IRPJ e a CSLL sob o regime de apuração pelo lucro real trimestral a partir, inclusive, do trimestre da ocorrência do fato. Tal situação também é possível de ocorrer na hipótese de exclusão do Refis de empresa incluída neste programa como sendo do lucro presumido, embora obrigada ao lucro real.","Sim. Se a pessoa jurídica que houver pago o imposto com base no lucro presumido incorrer em situação de obrigatoriedade de apuração pelo lucro real por ter auferido lucros, rendimentos ou ganhos de capital oriundos do exterior em relação ao mesmo ano-calendário, ela deverá apurar o IRPJ e a CSLL sob o regime de apuração pelo lucro real trimestral a partir, inclusive, do trimestre da ocorrência do fato."
"Pessoa Jurídica que apresentou declaração com base no lucro presumido  poderá, após a entrega, pedir retificação para efeito de declarar pelo lucro real?","Após a entrega da declaração de informações com base no lucro presumido, não há mais como o contribuinte alterar a sua opção. Entretanto, será admitida a retificação da declaração quando o contribuinte comprovar ter exercido irregularmente a opção pelo lucro presumido, na hipótese em que a legislação fiscal expressamente torne obrigatória a sua tributação com base no lucro real; ou, ainda, quando for constatado tal fato por meio de procedimento de ofício, o qual poderá adotar a tributação com base no lucro real quando exigido por lei, ou o lucro arbitrado, dependendo do caso.","Não. A retificação da ECF não é admitida quando tiver por objetivo a mudança do regime de tributação. Portanto, a pessoa jurídica que apresentou a declaração com base no lucro presumido não pode retificá-la para declarar pelo lucro real."
"A pessoa jurídica optante pelo lucro presumido que mantiver escrituração  regular e apurar lucro contábil poderá utilizá-lo como reserva livre para aumento  de capital, sem ônus tributário (voltando ou não à tributação pelo lucro real)?","Na hipótese de apuração de lucro contábil, a pessoa jurídica poderá utilizar o montante desse lucro como reserva livre para aumento de capital. Entretanto, não poderá utilizar a esse título todo o montante do lucro contábil, devendo dele diminuir o valor do imposto de renda apurado com base no lucro presumido, inclusive adicional, o valor das contribuições (CSLL, Cofins e PIS/Pasep), bem assim os valores que forem distribuídos a título de lucros ao seu titular, sócio ou acionista.","Sim. De acordo com a regra prevista para a hipótese do § 2º do art. 51 da IN nº 11/1996, a parcela dos lucros que exceder o valor da base de cálculo do imposto (ou seja, o lucro contábil apurado na escrituração regular que supere o lucro presumido) será distribuída sem a incidência do imposto de renda. Esse valor é determinado deduzindo-se do lucro líquido do período, após o imposto de renda, o valor correspondente ao lucro presumido. 

Portanto, os lucros apurados contabilmente que excederem o lucro presumido são isentos da incidência do imposto de renda na distribuição. Como a referida norma garante que essa parcela excedente pode ser distribuída sem ônus tributário (sem incidência do imposto), ela pode ser utilizada livremente pela pessoa jurídica, inclusive como reserva para aumento de capital, independentemente de a empresa voltar ou não ao regime de tributação pelo lucro real."
De quais incentivos fiscais do IRPJ as empresas que optarem pelo lucro  presumido poderão se utilizar?,Do imposto apurado com base no lucro presumido não é permitida qualquer dedução a título de incentivo fiscal.,Nenhuma. A legislação veda expressamente qualquer dedução a título de incentivo fiscal do imposto sobre a renda devido pelas pessoas jurídicas.
Como poderá ser compensado o imposto pago a maior no período de apuração?,"No caso em que o valor retido na fonte ou já pago pelo contribuinte for maior que o imposto devido no período de apuração trimestral, a diferença a maior poderá ser compensada com o imposto relativo aos períodos de apuração subsequentes. ","A diferença poderá ser utilizada na compensação de débitos próprios, nos termos estabelecidos no art. 940."
O que poderá acontecer à pessoa jurídica que optar indevidamente ou deixar de  cumprir alguma das condições estabelecidas para opção pelo lucro presumido?,"Inicialmente será verificada a possibilidade de apuração da base de cálculo do imposto de renda pelo lucro real, caso a empresa mantenha escrituração regular com base nas leis comerciais e fiscais. Na impossibilidade de adoção de tal procedimento, deverá ser arbitrado o lucro da pessoa jurídica no respectivo período de apuração.",A pessoa jurídica terá o imposto sobre a renda devido trimestralmente determinado com base nos critérios do lucro arbitrado.
Como será manifestada pelo contribuinte a tributação com base no lucro  arbitrado?,"A tributação com base no lucro arbitrado será manifestada mediante o pagamento da primeira quota ou da quota única do imposto devido, correspondente ao período de apuração trimestral em que o contribuinte, conhecendo sua receita bruta, verificou que incidiu em uma das hipóteses que ensejam o arbitramento de seu lucro.","A tributação com base no lucro arbitrado será manifestada pelo contribuinte mediante o pagamento do imposto sobre a renda correspondente, desde que conhecida a receita bruta e ocorridas as hipóteses legais previstas. Esse pagamento terá por vencimento o último dia útil do mês subsequente ao do encerramento de cada período de apuração."
"Em caso de arbitramento do lucro, ficam as pessoas jurídicas dispensadas das  penalidades e da comprovação da origem das receitas recebidas?","Não. Mesmo sendo tributadas com base no lucro arbitrado, persiste a obrigatoriedade de comprovação das receitas efetivamente recebidas ou auferidas. O arbitramento de lucro é uma forma de apuração da base de cálculo do imposto, e não uma sanção. Assim, sua utilização não afasta a aplicação das penalidades cabíveis, como as decorrentes do descumprimento da legislação tributária em relação às obrigações acessórias.","Não, em caso de arbitramento do lucro, as pessoas jurídicas não ficam dispensadas das penalidades cabíveis. Quanto à comprovação da origem das receitas recebidas, a informação não é clara no contexto fornecido, não sendo possível afirmar se há ou não dispensa."
Como a pessoa jurídica que apura o Imposto sobre a Renda com base na  estimativa de lucro mensal pode compensar o imposto pago indevidamente ou  a maior em relação ao apurado com base na estimativa de lucro no respectivo  mês?,"Os valores do IRPJ e da CSLL pagos e que excederem os apurados com base na estimativa de lucro no respectivo mês somente podem ser utilizados no final do período de apuração em que houve o pagamento indevido ou maior que o devido para: a) dedução do IRPJ ou da CSLL; b) ou compor o saldo negativo de IRPJ ou de CSLL. No caso de pagamento calculado com base na estimativa de lucro mensal, o final do período de apuração é, em regra, 31 de dezembro. Excepcionalmente, no caso de pessoas jurídicas submetidas aos seguintes eventos, o final do período de apuração será a data do evento: a) incorporação, fusão ou cisão; b) extinção da pessoa jurídica, pelo encerramento da liquidação.","A pessoa jurídica tributada pelo lucro presumido (que apura o imposto com base na estimativa mensal) pode compensar o valor do IRPJ ou da CSLL retido indevidamente ou a maior utilizando-o apenas para deduzir o IRPJ ou a CSLL devidos ao final do período de apuração em que ocorreu a retenção, ou para compor o saldo negativo desses tributos no respectivo período."
"Como a pessoa jurídica que apura o IRPJ com base na estimativa de lucro mensal  pode compensar o Imposto sobre a Renda Retido na Fonte (IRRF), retido  indevidamente ou a maior que o devido?","Os valores do IRRF e da CSLL retidos na fonte e que excederem os apurados com base na estimativa de lucro no respectivo mês somente podem ser utilizados no final do período de apuração em que houve a retenção para: a) dedução do IRPJ ou da CSLL; b) ou compor o saldo negativo de IRPJ ou de CSLL. No caso de pagamento calculado com base na estimativa de lucro mensal, o final do período de apuração é, em regra, 31 de dezembro. Excepcionalmente, no caso de pessoas jurídicas submetidas aos seguintes eventos, o final do período de apuração será a data do evento: a) incorporação, fusão ou cisão; b) extinção da pessoa jurídica, pelo encerramento da liquidação.",A pessoa jurídica pode compensar o valor do IRRF retido indevidamente ou a maior utilizando-o somente na dedução do IRPJ devido ao final do período de apuração em que houve a retenção ou para compor o saldo negativo de IRPJ desse mesmo período.
A base de cálculo negativa da CSLL poderá ser compensada com resultados  apurados em períodos subsequentes?,"Sim. A base de cálculo da CSLL, quando negativa, poderá ser compensada até o limite de 30% dos resultados apurados em períodos subsequentes, ajustados pelas adições e exclusões previstas na legislação.","Sim, a base de cálculo negativa da CSLL poderá ser compensada cumulativamente com o resultado de períodos de apuração subsequentes, ajustado pelas adições e exclusões previstas na legislação, observado o limite máximo de redução de 30%."
Os rendimentos e ganhos de capital auferidos no exterior sujeitam-se à  incidência da CSLL?,"Sim. O art. 21 da MP nº 2.158-35, de 2001, determina que os lucros, rendimentos e ganhos de capital auferidos no exterior ficam sujeitos à incidência da CSLL, observadas as normas de tributação universal. O parágrafo único do mencionado artigo, por seu turno, preconiza que o saldo do imposto de renda pago no exterior, que exceder o valor compensável com o IRPJ devido no Brasil, poderá ser compensado com a CSLL devida em virtude da adição, à sua base de cálculo, dos lucros oriundos do exterior, até o limite acrescido em decorrência dessa adição.","Sim, os lucros, rendimentos e ganhos de capital auferidos no exterior sujeitam-se à incidência da CSLL."
O registro da CSLL como despesa afetará o cálculo do lucro da exploração?,"A CSLL será adicionada ao lucro líquido do período de apuração, antes da provisão para o imposto de renda, para efeito de determinação do lucro da exploração, que servirá de base de cálculo de incentivos fiscais.","Sim, o registro da CSLL afetará o cálculo do lucro da exploração. A CSLL devida, após a compensação com a COFINS, será adicionada ao lucro líquido para a determinação do lucro da exploração."
"O valor correspondente à CSLL será considerado como despesa dedutível, para  efeito de determinação do lucro real?","Não. O valor da CSLL não pode ser deduzido para efeito da determinação do lucro real, nem da sua própria base de cálculo. O valor da CSLL que for considerado como custo ou despesa deverá ser adicionado ao lucro líquido para efeito de determinação do lucro real.","Não, o valor correspondente à CSLL não será considerado como despesa dedutível para efeito de determinação do lucro real. Ele não poderá ser deduzido e, caso tenha sido registrado como custo ou despesa, deverá ser adicionado ao lucro líquido do respectivo período de apuração para a determinação do lucro real."
Quais as pessoas jurídicas que têm seu ingresso permitido nas sociedades  cooperativas?,Em situações específicas é possível o ingresso de pessoa jurídica nas sociedades cooperativas de pescas e nas cooperativas constituídas por produtores rurais ou extrativistas que pratiquem as mesmas atividades econômicas das pessoas físicas associadas. ,"Nas sociedades cooperativas, o ingresso de pessoas jurídicas é permitido nas seguintes situações:

- Nas cooperativas de pesca e nas constituídas por produtores rurais ou extrativistas, desde que pratiquem as mesmas atividades econômicas das pessoas físicas associadas.
- Nas cooperativas de eletrificação, irrigação e telecomunicações, desde que se localizem na respectiva área de operações da cooperativa."
"Se o sujeito passivo não atender, no prazo estipulado, à intimação para prestar  esclarecimentos, apresentar os arquivos ou sistemas de que tratam os arts. 11 a  13 da Lei 8.218/91 ou a documentação técnica de que trata o art. 38 da Lei  9.430/96, quais são os percentuais de multa a serem aplicados?","Nesse caso caberá multa de ofício de 112,5% se o sujeito, além de não ter atendido à intimação, não pagou o débito ou não apresentou declaração. Ou de 225% se o sujeito, além dos motivos que ensejariam a aplicação da multa de 112,5%, incorrer também em crime contra a ordem tributária, de sonegação, fraude ou conluio. Esses percentuais correspondem à multa de 75% (Lei 9.430, art. 44, I) aumentada de 50% (75% x 1,5 = 112,5%), ou à multa de 150% (Lei 9.430, art. 44, § 1º) aumentada de 50% (150% x 1,5 = 225%).","Os percentuais de multa serão aumentados de metade. 

Assim, a multa de 75% (sobre a totalidade ou diferença de imposto ou contribuição nos casos de falta de pagamento, falta de declaração ou declaração inexata) passará para 112,5%. 

Nos casos do § 1º, a multa de 100% passará para 150%, e a multa de 150% passará para 225%. 

A multa de 50% (exigida isoladamente sobre o valor do pagamento mensal não efetuado) passará para 75%."
