Q,A,A_model
"Qual o regime de tributação da pessoa jurídica que auferir lucros, rendimentos  e ganhos de capital do exterior?","A pessoa jurídica que auferir lucros, rendimentos ou ganhos de capital do exterior fica obrigada à tributação com base no lucro real, a partir, inclusive, do trimestre de sua ocorrência.",Lucro real
"Se o contribuinte for optante do lucro presumido e, em algum período auferir  lucros, rendimentos e ganhos de capital do exterior?","A pessoa jurídica que houver pago o imposto com base no lucro presumido e que, em relação ao mesmo ano-calendário, incorrer em situação de obrigatoriedade de apuração pelo lucro real por ter auferido lucros, rendimentos ou ganhos de capital oriundos do exterior, deverá apurar o imposto sobre a renda de pessoa jurídica (IRPJ) e a contribuição social sobre o lucro líquido (CSLL) sob o regime de apuração pelo lucro real trimestral a partir, inclusive, do trimestre da ocorrência do fato. 555","Se o contribuinte optante do lucro presumido auferir lucros, rendimentos ou ganhos de capital oriundos do exterior, ele será obrigado a apurar o Imposto de Renda da Pessoa Jurídica (IRPJ) e a Contribuição Social sobre o Lucro Líquido (CSLL) pelo regime de apuração do lucro real trimestral, a partir do trimestre em que ocorrer esse fato."
Como serão tributados no Brasil os lucros auferidos no exterior por intermédio  de filiais e sucursais da pessoa jurídica no Brasil?,"Para fins de apuração do lucro real e da base de cálculo da CSLL, os lucros auferidos por filiais e sucursais no exterior serão adicionados integralmente ao lucro líquido da pessoa jurídica no Brasil em 31 de dezembro do ano-calendário em que tiverem sido disponibilizados.","Os lucros auferidos no exterior por intermédio de filiais e sucursais serão computados para fins de determinação do lucro real e da base de cálculo da CSLL da pessoa jurídica domiciliada no Brasil. Essa computação ocorre no balanço levantado em 31 de dezembro do ano-calendário em que os resultados positivos tiverem sido disponibilizados para a pessoa jurídica no Brasil. O resultado no exterior deve ser apurado segundo as normas da legislação comercial do país de domicílio e antes da tributação no exterior sobre o lucro. Caso não existam normas expressas que regulem a elaboração de demonstrações financeiras no país de domicílio, elas deverão ser elaboradas observando os princípios contábeis geralmente aceitos, segundo as normas da legislação brasileira."
Quando se consideram disponibilizados os lucros auferidos no exterior por  intermédio filiais e sucursais da pessoa jurídica?,Consideram-se disponibilizados na data do balanço no qual tiverem sido apurados.,Os lucros auferidos no exterior por intermédio de filiais ou sucursais são considerados disponibilizados na data do balanço no qual tiverem sido apurados.
Os resultados auferidos por filiais e sucursais podem ser consolidados?,"Desde que as filiais e sucursais sejam domiciliadas num mesmo país, e, tendo a matriz no Brasil indicado uma dessas filiais ou sucursais como entidade líder, os resultados poderão ser consolidados por país, e os prejuízos de uma poderão ser compensados com os lucros da outra.","Sim, os resultados auferidos por filiais e sucursais domiciliadas num mesmo país podem ser consolidados, desde que a matriz no Brasil indique uma dessas filiais ou sucursais como entidade líder."
"Como deverão ser convertidos os lucros auferidos no exterior por intermédio de  filiais, sucursais, controladas ou coligadas?","Os lucros auferidos no exterior por intermédio de filiais, sucursais, controladas ou coligadas serão convertidos em Reais pela taxa de câmbio, para venda, do dia das demonstrações financeiras em que tenham sido apurados os correspondentes lucros.","Os lucros auferidos no exterior devem ser convertidos para Reais utilizando a taxa de câmbio da moeda do país de origem fixada para venda pelo Banco Central do Brasil, correspondente à data do levantamento de balanço da controlada direta ou indireta. Caso a moeda do país de origem não tenha cotação no Brasil, o valor será primeiramente convertido para Dólares dos Estados Unidos da América e, em seguida, para Reais."
"Como deve ser apurado o limite admitido de compensação do tributo pago no  exterior sobre lucros auferidos por meio de controladas, coligadas, filiais ou  sucursais?","A pessoa jurídica deverá calcular o valor: a) do imposto pago no exterior, correspondente aos lucros de cada filial, sucursal, controlada ou coligada, bem assim aos rendimentos e ganhos de capital, que foram computados na determinação do lucro real; b) do imposto sobre a renda e CSLL devidos sobre o lucro real antes e após a inclusão dos lucros auferidos no exterior. O imposto, passível de compensação, não poderá exceder o valor determinado na letra “a” anterior, nem à diferença positiva entre os valores calculados sobre o lucro real com e sem a inclusão dos referidos lucros, rendimentos ou ganhos de capital auferidos no exterior e referidos na letra “b”.","O limite admitido de compensação do tributo pago no exterior é apurado da seguinte forma:

1. Calcula-se o valor do imposto pago no exterior correspondente aos lucros de cada controlada, coligada, filial ou sucursal que foram computados na determinação do lucro real;
2. Calcula-se o valor do imposto sobre a renda (inclusive adicional) e da CSLL devidos no Brasil sobre o lucro real antes e após a inclusão dos lucros auferidos no exterior;
3. O valor passível de dedução não pode exceder o imposto pago no exterior calculado individualmente por investida, nem a diferença positiva entre os impostos devidos no Brasil apurados com e sem a inclusão dos referidos lucros.

Além disso, esse cálculo deve ser efetuado antes da compensação de prejuízo fiscal acumulado no Brasil de anos-calendário anteriores. 

Caso o lucro real seja positivo, mas inferior ao total dos lucros, rendimentos e ganhos de capital computados, o tributo passível de compensação será determinado multiplicando-se a diferença entre aquele total e o lucro real pela alíquota de 15% (se não exceder o limite de isenção do adicional) ou de 25% (se exceder). Se o tributo efetivamente pago for inferior a esse valor calculado, somente o valor pago poderá ser compensado."
"Em que momento deve ser tributado o lucro gerado por uma empresa  estrangeira, classificada pela legislação brasileira como coligada ou porfólio de  investimento sem influência nem relevância, cuja participação societária seja  detida por uma por controlada direta ou indireta da controladora brasileira?","Os lucros gerados por empresas tidas como coligadas das controladas diretas ou indiretas ou como participações em empresas de portfólio, detidas por controlada direta ou indireta domiciliadas no exterior, serão tributados pela controladora brasileira quando forem reconhecidos no balanço da controlada direta ou indireta, segundo a legislação comercial de sua jurisdição.","O lucro gerado por essa empresa estrangeira deve ser tributado no momento da apuração dos lucros pela pessoa jurídica investida no exterior, devendo ser adicionado ao lucro líquido relativo ao balanço de 31 de dezembro do ano-calendário em que os lucros tenham sido apurados. 

Isso ocorre porque, ao ser a participação societária detida por uma controlada direta ou indireta da controladora brasileira, a pessoa jurídica coligada domiciliada no Brasil é equiparada à controladora. Nessa hipótese, não se aplica a regra geral de tributação diferida, de modo que os resultados auferidos por intermédio de outra pessoa jurídica, na qual a coligada no exterior mantiver qualquer tipo de participação societária, ainda que indiretamente, são consolidados no balanço desta para fins de determinação do lucro real e da base de cálculo da CSLL da pessoa jurídica coligada no Brasil."
A variação cambial acrescida aos juros calculados com base na taxa LIBOR são  considerados dedutíveis na apuração do lucro real?,"Sim, uma vez que a referida variação cambial é um componente dos juros para o pagamento do imposto de renda diferido relativo aos lucros auferidos no exterior.","Sim, a variação cambial acrescida aos juros calculados com base na taxa LIBOR é considerada dedutível na apuração do lucro real, pois o texto legal estabelece que os juros calculados conforme o § 3º (que incluem a taxa LIBOR acrescida da variação cambial) são dedutíveis na apuração do lucro real e da base de cálculo da CSLL."
"Dos resultados das controladas diretas ou indiretas no exterior não devem  constar os resultados auferidos por outra pessoa jurídica sobre a qual a  controladora brasileira mantenha o controle direto ou indireto. Esta regra se  aplica também para a apuração do estoque de prejuízos anteriores a  01/01/2015, passiveis de compensação com lucros futuros para efeitos de  tributação no Brasil?","Em obediência à uniformidade de critério, na falta de ressalva em Lei, dos prejuízos contábeis anteriores a 2015 não devem constar resultados (lucros ou prejuízos) originados da participação em outra pessoa jurídica sobre a qual a controladora brasileira mantenha controle direto ou indireto.","A informação fornecida não especifica se a regra de exclusão dos resultados auferidos por outra pessoa jurídica controlada aplica-se à apuração do estoque de prejuízos anteriores a 01/01/2015 passíveis de compensação com lucros futuros. O texto apenas estabelece a regra geral de que os resultados das controladas diretas ou indiretas não devem conter os resultados de outra pessoa jurídica controlada, sem abordar situações de prejuízos acumulados ou marcos temporais específicos. Portanto, não é possível afirmar se a regra se aplica a esse cálculo de estoque de prejuízos."
Qual é o valor da parcela do investimento referente ao lucro ou prejuízo de  investimento no exterior que deve ser registrada na subconta de investimento?,"O valor a ser registrado na subconta de investimento é o equivalente aos lucros ou prejuízos antes da tributação no exterior sobre tais lucros ou prejuízos, assim entendido como o lucro ou prejuízo antes dos tributos sobre a renda, sejam correntes e/ou diferidos.","O valor a ser registrado na subconta é a parcela do ajuste do valor do investimento equivalente aos lucros auferidos pela controlada, direta ou indiretamente, antes da tributação no exterior sobre o lucro."
"Nos casos em que o ajuste de preço de transferência/subcapitalização é maior  que o valor do lucro auferidos no exterior, será possível “carregar” para os anos  subsequentes o valor residual do ajuste que não foi deduzido da base de IR/CSLL  no ano que foi apurado? Em caso negativo, como remover o efeito de ""dupla  tributação"" sobre a parcela do ajuste que excede o valor dos lucros?","A dedução é limitada ao valor do lucro auferido no exterior pela controlada, não havendo previsão legal, para o aproveitamento de excedente em anos posteriores.","Não, não será possível carregar o valor residual para os anos subsequentes. O § 2º, inciso III, estabelece que a dedução deve estar limitada ao valor do lucro auferido pela controlada no exterior, o que impede a dedução de um excedente e a norma não prevê a possibilidade de compensação ou ""carrego"" de saldos não utilizados para períodos futuros.

Em relação à remoção do efeito de dupla tributação sobre a parcela do ajuste que excede o valor dos lucros, as informações fornecidas não apresentam um mecanismo específico para eliminar essa dupla tributação no próprio ajuste corporal. Pelo contrário, o § 4º agrava a carga tributária sobre essa parcela excedente, ao determinar que o imposto pago no exterior, na proporção do valor do investimento que deixar de ser tributado em razão da aplicação da limitação da dedução, não poderá ser aproveitado para dedução do imposto devido no Brasil. Assim, com base exclusivamente nas informações disponíveis, não há previsão de como remover a dupla tributação sobre o excesso."
"Quais os limites aplicáveis, para a pessoa jurídica domiciliada no Brasil, nos casos  de endividamento quando o credor for pessoa física ou jurídica residente,  domiciliada ou constituída no exterior, em país ou dependência com tributação  favorecida ou sob regime fiscal privilegiado?","No caso de credor, pessoa física ou jurídica, residente, domiciliada ou constituída no exterior, em país ou dependência com tributação favorecida ou sob regime fiscal privilegiado, tanto o limite individual quanto o limite global de endividamento (somatório dos endividamentos com todas as entidades situadas naqueles países) estão limitados a 30% do valor do patrimônio líquido da pessoa jurídica residente no Brasil.","O valor total do somatório dos endividamentos com todas as entidades situadas em país ou dependência com tributação favorecida ou sob regime fiscal privilegiado não pode ser superior a 30% (trinta por cento) do valor do patrimônio líquido da pessoa jurídica residente no Brasil. Caso haja excesso em relação a esse limite, o valor dos juros relativos ao excedente será considerado despesa não necessária à atividade da empresa e não será dedutível para fins do Imposto de Renda e da Contribuição Social sobre o Lucro Líquido."
Em quais hipóteses existe a possibilidade de apropriação de créditos presumidos  da Contribuição para o PIS/Pasep e da Cofins relativos a selo de controle e  equipamentos de controle de produção?,"As pessoas jurídicas obrigadas pela RFB à utilização do selo de controle de que trata o art. 46 da Lei nº 4.502, de 30 de novembro de 1964; e dos equipamentos contadores de produção de que tratam os arts. 27 a 30 da Lei nº 11.488, de 2007, e o art. 58-T da Lei nº 10.833, de 2003, poderão deduzir da Contribuição para o PIS/PASEP ou da COFINS devidas em cada período de apuração, crédito presumido correspondente à taxa de que trata o art. 13 da Lei nº 12.995, de 2014, efetivamente paga no mesmo período","A apropriação de créditos presumidos da Contribuição para o PIS/Pasep e da Cofins relativos a selo de controle e equipamentos de controle de produção é possível nas seguintes hipóteses:

1. Quando os selos de controle forem adquiridos por fabricantes de cigarros e bebidas, bem como por importadores de bebidas, para aplicação em seus produtos;
2. Quando os equipamentos de controle de produção forem adquiridos por fabricantes de cigarros e bebidas, destinados ao controle e à fiscalização da produção.

Esses créditos presumidos são utilizados para descontar os valores devidos das referidas contribuições, compensando os custos incorridos com a aquisição desses itens exigidos para o controle e rastreamento da produção."
"De que forma devem ser apurados e registrados os créditos do art. 3º da Lei nº  10.637, de 2002, do art. 3º da Lei nº 10.833, de 2003, e do arts. 15 e 17 da Lei nº  10.865, de 2004, e os demais créditos presumidos da Contribuição para o  PIS/Pasep e da Cofins?","As pessoas jurídicas submetidas ao regime de apuração não cumulativa deverão apurar e registrar, de forma segregada, os créditos de que tratam o art. 3º da Lei nº 10.637, de 2002, o art. 3º da Lei nº 10.833, de 2003, e os arts. 15 e 17 da Lei nº 10.865, de 2004, e os créditos presumidos previstos nas Leis da Contribuição para o PIS/Pasep e da Cofins, discriminando-os em função da natureza, origem e vinculação desses créditos, observadas as normas editadas pela Secretaria da Receita Federal do Brasil.","As pessoas jurídicas submetidas ao regime de apuração não cumulativa devem apurar e registrar os referidos créditos de forma segregada, discriminando-os em função da natureza, origem e vinculação, observando as normas editadas pela Secretaria da Receita Federal do Brasil."
Quais as exclusões admitidas para efeito de apuração da base de cálculo da  Contribuição para o PIS/Pasep e da Cofins devidas pelas sociedades cooperativas  de rádio táxi?,"Além das exclusões admitidas para as sociedades cooperativas em geral, as sociedades cooperativas de rádio táxi podem ainda excluir da base de cálculo: 1) os valores repassados aos associados pessoas físicas decorrentes de serviços por eles prestados em nome da cooperativa; 2) as receitas de vendas de bens, mercadorias e serviços a associados, quando adquiridos de pessoas físicas não associadas; e 3) as receitas financeiras decorrentes de repasses de empréstimos a associados, contraídos de instituições financeiras, até o limite dos encargos a estas devidos. ","As cooperativas de rádio táxi podem excluir da base de cálculo da contribuição para PIS/Pasep e Cofins:

1. Os valores repassados aos associados pessoas físicas decorrentes de serviços por eles prestados em nome da cooperativa;
2. As receitas de vendas de bens, mercadorias e serviços a associados, quando adquiridos de pessoas físicas não associadas;
3. As receitas financeiras decorrentes de repasses de empréstimos a associados, contraídos de instituições financeiras, até o limite dos encargos a estas devidos."
"Considerando que todas as informações de interesse do fisco estão disponíveis  no SPED, a empresa vai poder eliminar os documentos físicos (em papel) que  serviram de base para a escrituração contábil e fiscal?","Todos os documentos em papel (notas fiscais, contratos, recibos, etc.) que dão suporte aos respectivos lançamentos contábeis e fiscais devem ser mantidos pelo prazo previsto nas legislações comercial e fiscal.","Não. A empresa não pode eliminar os documentos físicos. A apresentação do arquivo digital não a dispensa da guarda dos documentos que deram origem às informações, devendo mantê-los na forma e nos prazos estabelecidos pela legislação aplicável."
"Na ocorrência da adoção de novo método ou critério contábil, os contribuintes  já estão autorizados a fazer os referidos ajustes na apuração do lucro real, da  base de cálculo da CSLL, da COFINS e do PIS, até que a lei tributária regule a  matéria? Ou o contribuinte precisa de uma norma da RFB autorizando efetuar  tais ajustes?","Não. Quando houver modificação ou adoção de novo método ou critério contábil por meio de ato administrativo emitido com base em competência atribuída em lei comercial, a Secretaria Especial da Receita Federal do Brasil irá dispor sobre os procedimentos para anular os efeitos desses atos.","Os contribuintes não estão autorizados a fazer os referidos ajustes por conta própria na apuração dos tributos federais até que uma lei tributária regule a matéria. É necessária uma norma da Receita Federal do Brasil (RFB) autorizando e disciplinando os procedimentos. A própria RFB é quem deve dispor, em atos específicos, sobre os procedimentos para anular os efeitos dos atos administrativos que modificam ou adotam métodos e critérios contábeis sobre a apuração dos tributos federais."
O controle por subcontas na adoção inicial se aplica aos ativos e passivos  relativos aos contratos de arrendamento mercantil nos quais haja  transferência substancial dos riscos e benefícios inerentes à propriedade do  bem em curso na data da adoção inicial?,"Não. Para os ativos e passivos relativos aos contratos de arrendamento mercantil em curso na data da adoção inicial, nos quais haja transferência substancial dos riscos e benefícios inerentes à propriedade do bem arrendado, não se aplica o controle por subcontas de que tratam os arts. 294 a 300 da Instrução Normativa RFB n° 1.700, de 2017. O disposto acima aplica-se, inclusive, aos contratos não tipificados como arrendamento mercantil que contenham elementos contabilizados como arrendamento mercantil por força de normas contábeis e da legislação comercial. A partir da data da adoção inicial, deverá ser observado o tratamento tributário previsto nos arts. 172 a 177 da Instrução Normativa RFB n° 1.700, de 2017.","Não, o controle por subcontas não se aplica aos contratos de arrendamento mercantil em curso na data da adoção inicial nos quais haja transferência substancial dos riscos e benefícios inerentes à propriedade do bem arrendado."
O contribuinte pode efetuar a exclusão da diferença negativa entre o saldo do  ativo diferido registrado na contabilidade societária e no FCONT?,"A diferença negativa verificada na data da adoção inicial entre o valor de ativo diferido na contabilidade societária e no FCONT somente poderá ser excluída se o contribuinte evidenciar essa diferença em subconta vinculada ao ativo. A diferença poderá ser controlada de duas formas: 1) por meio da utilização de uma única subconta, sendo o lançamento a crédito na subconta e a débito na conta de ativo diferido; 2) por meio da utilização de 2 (duas) subcontas, sendo o lançamento a crédito na subconta vinculada ao ativo diferido e a débito em uma subconta auxiliar à subconta vinculada ao ativo. A diferença poderá ser excluída em cada período de apuração proporcionalmente à parcela equivalente à amortização do ativo diferido de acordo com as normas e critérios tributários vigentes em 31 de dezembro de 2007. No caso de ativo diferido não reconhecido na data da adoção inicial na contabilidade societária, mas reconhecido no FCONT, a diferença deverá ser controlada na Parte B do e-Lalur e do e-Lacs.","Sim, o contribuinte pode efetuar a exclusão da diferença negativa verificada na data da adoção inicial entre o valor do ativo diferido na contabilidade societária e no FCONT, desde que evidencie contabilmente essa diferença em subconta vinculada ao ativo, obedecidas as condições estabelecidas nos parágrafos do art. 298. A exclusão poderá ser realizada em cada período de apuração proporcionalmente à parcela equivalente à amortização do ativo diferido de acordo com as normas e critérios tributários vigentes em 31 de dezembro de 2007."
Qual deve ser o procedimento adotado pelo contribuinte no caso de contrato  de concessão de serviços públicos na adoção inicial?,"No caso de contrato de concessão de serviços públicos, o contribuinte deverá: 1) calcular o resultado tributável do contrato de concessão acumulado até a data da adoção inicial, considerando os métodos e critérios vigentes em 31 de dezembro de 2007; 2) calcular o resultado tributável do contrato de concessão acumulado até a data da adoção inicial, considerando as disposições da Instrução Normativa RFB nº 1.700/2017 e da Lei nº 6.404, de 1976; 3) calcular a diferença entre os valores referidos nos itens 1 e 2 acima, que deverá ser controlada na Parte B do e-Lalur e do e-Lacs; e 4) adicionar, se negativa, ou excluir, se positiva, a diferença referida no item 3 acima na apuração do lucro real e do resultado ajustado em quotas fixas mensais durante o prazo restante de vigência do contrato. O contribuinte deverá conservar os documentos comprobatórios da diferença enquanto os períodos de apuração abrangidos pelo contrato estiverem sujeitos a verificação por parte da Secretaria Especial da Receita Federal do Brasil. 774","Na adoção inicial de contrato de concessão de serviços públicos, o contribuinte deve seguir os seguintes procedimentos:

1. Calcular o resultado tributável do contrato acumulado até a data da adoção inicial, utilizando os métodos e critérios vigentes em 31 de dezembro de 2007;
2. Calcular o resultado tributável do contrato acumulado até a data da adoção inicial, utilizando as disposições da Instrução Normativa e da Lei nº 6.404, de 1976;
3. Calcular a diferença entre os valores apurados nos dois cálculos anteriores;
4. Adicionar (se a diferença for negativa) ou excluir (se a diferença for positiva) esse valor na apuração do lucro real e do resultado ajustado, em quotas fixas mensais, durante o prazo restante de vigência do contrato.

Adicionalmente, a diferença calculada deve ser controlada na parte B do e-Lalur e do e-Lacs, e o contribuinte deve conservar os documentos comprobatórios dessa diferença enquanto os períodos de apuração do contrato estiverem sujeitos à verificação pela RFB. A partir da adoção inicial, o resultado tributável de todos os contratos de concessão será determinado com base nas disposições da Instrução Normativa e da Lei nº 6.404, de 1976."
